-- MariaDB dump 10.19  Distrib 10.6.14-MariaDB, for debian-linux-gnu (x86_64)
--
-- Host: localhost    Database: rsud_cimacan_website_db
-- ------------------------------------------------------
-- Server version	10.6.14-MariaDB-1:10.6.14+maria~ubu2004

/*!40101 SET @OLD_CHARACTER_SET_CLIENT=@@CHARACTER_SET_CLIENT */;
/*!40101 SET @OLD_CHARACTER_SET_RESULTS=@@CHARACTER_SET_RESULTS */;
/*!40101 SET @OLD_COLLATION_CONNECTION=@@COLLATION_CONNECTION */;
/*!40101 SET NAMES utf8mb4 */;
/*!40103 SET @OLD_TIME_ZONE=@@TIME_ZONE */;
/*!40103 SET TIME_ZONE='+00:00' */;
/*!40014 SET @OLD_UNIQUE_CHECKS=@@UNIQUE_CHECKS, UNIQUE_CHECKS=0 */;
/*!40014 SET @OLD_FOREIGN_KEY_CHECKS=@@FOREIGN_KEY_CHECKS, FOREIGN_KEY_CHECKS=0 */;
/*!40101 SET @OLD_SQL_MODE=@@SQL_MODE, SQL_MODE='NO_AUTO_VALUE_ON_ZERO' */;
/*!40111 SET @OLD_SQL_NOTES=@@SQL_NOTES, SQL_NOTES=0 */;

--
-- Table structure for table `t_admin`
--

DROP TABLE IF EXISTS `t_admin`;
/*!40101 SET @saved_cs_client     = @@character_set_client */;
/*!40101 SET character_set_client = utf8 */;
CREATE TABLE `t_admin` (
  `id` varchar(255) NOT NULL,
  `username` varchar(255) NOT NULL,
  `password` varchar(255) NOT NULL,
  `name` varchar(255) NOT NULL,
  `email` varchar(255) NOT NULL,
  `role` int(255) NOT NULL,
  `create_date` datetime NOT NULL,
  `update_date` datetime NOT NULL,
  PRIMARY KEY (`id`)
) ENGINE=InnoDB DEFAULT CHARSET=utf8mb4 COLLATE=utf8mb4_general_ci;
/*!40101 SET character_set_client = @saved_cs_client */;

--
-- Dumping data for table `t_admin`
--

LOCK TABLES `t_admin` WRITE;
/*!40000 ALTER TABLE `t_admin` DISABLE KEYS */;
INSERT INTO `t_admin` VALUES ('$qqr@!kdhnnn$$ppppkhdfhsshhhhnb','rsud_cimacan_admin','$2y$10$gSyz2U6n4AqJRhk9Ykw6tO.CMOs3CvwabGOefsgeuOFQ5TorJmJh.','Super Admin','superadmin@rsudcimacan.com',1,'2021-12-20 02:40:03','2021-12-20 02:40:03'),('qwertyuioplghjdbbvc5aascc','admin','$2a$11$3mv6g/yEDTsVudmI8dtCAe7fXv6iAvtv9L7f5ed/ePM6AoTP0IHQ2','Super Admin','',1,'2021-12-22 01:11:37','2021-12-22 01:11:37');
/*!40000 ALTER TABLE `t_admin` ENABLE KEYS */;
UNLOCK TABLES;

--
-- Table structure for table `t_article`
--

DROP TABLE IF EXISTS `t_article`;
/*!40101 SET @saved_cs_client     = @@character_set_client */;
/*!40101 SET character_set_client = utf8 */;
CREATE TABLE `t_article` (
  `id` int(11) NOT NULL AUTO_INCREMENT,
  `title` varchar(255) NOT NULL,
  `sub_desc` varchar(255) NOT NULL,
  `category` varchar(255) NOT NULL,
  `description` varchar(9999) NOT NULL,
  `author` varchar(255) NOT NULL,
  `img` varchar(255) NOT NULL,
  `status` varchar(25) NOT NULL DEFAULT 'publish',
  `create_date` datetime NOT NULL,
  `update_date` datetime NOT NULL DEFAULT current_timestamp(),
  PRIMARY KEY (`id`)
) ENGINE=InnoDB AUTO_INCREMENT=338 DEFAULT CHARSET=utf8mb4 COLLATE=utf8mb4_general_ci;
/*!40101 SET character_set_client = @saved_cs_client */;

--
-- Dumping data for table `t_article`
--

LOCK TABLES `t_article` WRITE;
/*!40000 ALTER TABLE `t_article` DISABLE KEYS */;
INSERT INTO `t_article` VALUES (4,'Diabetes Mellitus saat Puasa Ramadhan','Diabetes','EWc4aGs2mJrjY5LKOoT0gMXV','Halo Sahabat Cimacan..<br />Banyak nih dari Sahabat Cimacan yang bertanya kalau pasien dengan diabetes mellitus apakah boleh berpuasa?<br /><br />Mincan ada sedikit info nih untuk Sahabat Cimacan semua!<br />Pasien dengan diabetes mellitus tentunya boleh berpuasa namun ada beberapa hal yang penting diperhatikan, yaitu:<br />1. Penyesuaian nutrisi dan aktivitas fisik<br />2. Pengaturan dosis obat selama puasa<br />3. Pemantauan glukosa darah<br />4. Kapan seorang pasien harus membatalkan puasanya<br /><br />Jadi bagi pasien dengan DM tidak perlu khawatir untuk berpuasa yaa!<br />Pastikan untuk selalu melakukan pemantauan gula darah secara mandiri serta mengetahui gejala-gejala dari hipoglikemia dan hiperglikemia.<br />Jika Ingin berkonsultasi lebih lanjut dapat datang ke Poliklinik Penyakit Dalam RSUD Cimacan ya.<br /><br />Selamat menjalankan ibadah puasa bagia Sahabat Cimacan semua. Semoga ibadah kita hari ini diberikan kemudahan dan kelancaran.','Admin','article/20220511124233_Pasien-Diabetes-Mellitus-saat-Puasa-Ramadhan.jpg','publish','2022-04-07 12:42:33','2022-05-11 12:42:33'),(5,'Langkah Cuci Tangan Pakai Sabun dari WHO','WHO','EWc4aGs2mJrjY5LKOoT0gMXV','Haloo Sahabat Cimacan..<br />Setiap tahunnya tanggal 5 Mei 2022 diperingati sebagai Hari Kebersihan Tangan Sedunia!<br /><br />Tahukah Sahabat Cimacan semua, tangan merupakan salah satu pintu masuk segala penyakit! Berdasarkan data WHO, tangan mengandung bakter sebanyak 39.000 hingga 460.000 CFU per sentimeter kubik. Banyak sekali bukan? Hal ini berpotensi tinggi menyebabkan penyakit bagi diri sendiri dan orang sekitar.<br /><br />Menjaga tangan untuk tetap bersih adalah hal paling penting yang dapat kita lakukan untuk menghindari berbagai macam penyakit dan menyebarkan kuman kepada orang lain.<br /><br />Yuk kita belajar lebih lanjut mengenai langkah-langkah cuci tangan yang baik dan benar!<br />1. Basahi kedua tangan dengan air bersih<br />2. Tuangkan sabun secukupnya<br />3. Ratakan sabun dengan kedua tangan<br />4. Gosok punggung tangan dan sela-sela jari secara bergantian<br />5. Gosok jari-jari bagian dalam<br />6. Gosok telapak tangan dengan posisi jari saling mengait/mengunci<br />7. Gosok ibu jari secara berputar dalam genggaman tangan dan lakukan pada kedua tangan<br />8. Gosokkan ujung jari pada telapak tangan secara berputar pada kedua tangan<br />9. Bilas kedua tangan dengan air bersih dengan mengulang kembali 6 langkah<br /><br />Mudah bukan? Mari kita bersama-sama meningkatkan kebiasaan cuci tangan dengan cara yang baik dan benar.<br /><br />Lindungi diri, lindungi sesama dengan rajin mencuci tangan!<br /><br />World Hand Hygiene Day<br />Unite for safety: clean your hands','Admin','article/20220511130005_Langkah-Cuci-Sabun-dari-WHO.jpg','publish','2022-05-05 13:00:05','2022-05-11 13:00:05'),(6,'Lupus','Yuk Sahabat Cimacan kita ketahui lebih lanjut mengenai Lupus..','EWc4aGs2mJrjY5LKOoT0gMXV','Yuk Sahabat Cimacan kita ketahui lebih lanjut mengenai Lupus..<br /><br />Lupus merupakan penyakit autoimun kronis yang bisa menyebabkan peradangan di beberapa jaringan atau organ tubuh.<br /><br />Tubuh orang yang menderita lupus akan memproduksi antibodi dengan jumlah yang sangat besar dan justru menyerang tubuh dengan merusak sel-sel sehat sehingga membuat penderitanya kerap mengalami peradangan dan infeksi pada sistem jaringan tubuhnya.<br /><br />Penyakit ini terutama menyerang wanita usia produktif (15-50 tahun) dengan angka kematian yang cukup tinggi, meski begitu lupus juga dapat menyerang laki-laki, anak-anak, dan remaja.<br /><br />Lupus juga dikenal sebagai penyakit 1000 wajah karena memiliki sebaran gambaran klinis yang luas serta tampilan perjalanan penyakit yang beragam, sehingga seringkali menimbulkan kekeliruan dalam upaya mengenalinya.<br /><br />Penting bagi masyarakat untuk dapat mengenali gejala Lupus. Penanganan yang lebih cepat dipastikan bisa meningkatkan kesejahteraan, kualitas dan harapan hidup orang dengan lupus.<br /><br />Yuk kita sadari lupus sejak dini dengan mencermati sederet gejala dan tanda tandanya dengan SALURI (PerikSa LUpus SendiRI).<br /><br />Jika Anda mengalami minimal 4 gejala dari seluruh gejala yang disebutkan di atas, maka dianjurkan untuk segera melakukan konsultasi dengan dokter di Puskesmas atau Rumah Sakit agar dapat dilakukan pemeriksaan dan penanganan lebih lanjut.','Admin','article/20220511130859_apa-itu-lupus.jpg','publish','2022-05-10 13:08:59','2022-05-11 13:08:59'),(7,'Penyebab Hepatitis Akut Berat','Hepatitis','EWc4aGs2mJrjY5LKOoT0gMXV','Halo Sahabat Cimacan..<br />Kali ini Mincan mau berbagi informasi mengenai penyakit Hepatitis yang saat ini sedang marak terjadi nih. Yuk kita simak!<br /><br />Penyakit Hepatitis Akut yang hingga saat ini belum diketahui penyebabnya pertama kali ditemukan di Inggris pada tanggal 5 April 2022. Sejak saat itu, dilaporkan terjadi peningkatan kasus di Eropa, Asia, dan Amerika. WHO kemudian menetapkan penyakit Hepatitis Akut ini sebagai Kejadian Luar Biasa (KLB) sejak tanggal 15 April 2022.<br />Di Indonesia, terdapat beberapa dugaan kasus pasien anak hepatitis akut meninggal dalam kurun waktu 2 minggu hingga 13 Mei 2022. Penyakit Hepatitis Akut ini menyerang anak usia 0-16 tahun, paling banyak anak usia di bawah 10 tahun.<br /><br />Hingga saat ini belum diketahui penyebab pasti Hepatitis Akut. Sudah dilakukan pemeriksaan virus hepatitis A, B, C, D dan E didapatkan hasil non reaktif. Dugaan awal berasal penyebab hepatitis ini berasa dari Adenovirus 41, SARS CoV-2, virus ABV, dll. Adenovirus umumnya menular melalui saluran cerna dan saluran pernafasan. Cara menularnya diduga dari droplet, air yang tercemar dan transmisi kontak.<br /><br />Gejala awal Hepatitis Akut adalah demam disertai gangguan gastrointestinal seperti mual, muntah, sakit perut, dan diare. Gejala dapat berlanjut dengan air kencing berwarna pekat seperti teh, BAB putih pucat, kulit &amp; mata kuning, gangguan pembekuan darah, kejang hingga penurunan kesadaran.<br /><br />Tindakan untuk mencegah Hepatitis Akut pada anak?<br />- Tetap tenang, jangan panik<br />- Jaga kebersihan diri dan lingkungan dengan rutin cuci tangan pakai sabun, masak makanan hingga matang, dan hindari kontak dengan orang sakit<br />- Terapkan etika batuk dan disiplin prokes COVID-19 seperti pakai masker serta jaga jarak<br /><br />Apabila anak Anda mengalami gejala awal dari Hepatitis Akut, disarankan segera dirujuk ke fasilitas layanan kesehatan terdekat untuk mendapatkan penanganan medis lebih lanjut, jangan menunggu hingga timbul gejala lanjut.<br /><br />Kenali gejala awal dan segera memeriksakan Anak ke fasilitas layanan kesehatan agar segera mendapatkan penanganan yang cepat dan tepat.<br /><br />Sumber:<br />Kemenkes RI<br />PB IDI','Admin','article/20220517121036_penyebab-hepatitis.jpg','publish','2022-05-16 12:10:36','2022-05-17 12:10:36'),(8,'Faktor Risiko Hipertensi','Hipertensi','EWc4aGs2mJrjY5LKOoT0gMXV','Hipertensi merupakan penyakit yang dapat dicegah dan dikendalikan loh Sahabat Cimacan..<br /><br />Terdapat beberapa faktor risiko yang berpengaruh terhadap kejadian Hipertensi. Yuk kita kenali faktor risiko apa saja yang dapa mempengaruhi terjadinya Hipertensi!<br /><br />Faktor risiko yang tidak dapat dimodifikasi:<br />1. Usia<br />2. Jenis kelamin<br />3. Riwayat keluarga (genetik)<br /><br />Faktor risiko yang dapat dimodifikasi:<br />1. Kegemukan (obesitas)<br />2. Kurang aktivitas fisik<br />3. Merokok<br />4. Diet tinggi lemak<br />5. Konsumsi garam dan alkohol berlebih<br />6. Dislipidemia<br />7. Tingkat stress tinggi<br /><br />Apa saja komplikasi yang dapat disebabkan oleh Hipertensi?<br />- Penyakit jantung<br />- Stroke<br />- Penyakit ginjal<br />- Kerusakan mata<br />- Gangguan saraf<br />- Gangguan pembuluh darah<br /><br />Yuk kita rajin cek tekanan darah dan segera berobat dengan cepat dan tepat agar dapat mencegah komplikasi yang dapat ditimbulkan oleh hipertensi<br /><br />Sumber:<br />World Health Organization<br />American Heart Association<br />Kementerian Kesehatan RI','Admin','article/20220517121408_faktor-risiko-hipertensi.jpg','publish','2022-05-17 12:14:08','2022-05-17 12:14:08'),(9,'Cara Mengukur Tekanan Darah di Rumah','Tekanan','EWc4aGs2mJrjY5LKOoT0gMXV','Hipertensi sering disebut dengan The Silent Killer karena tidak memiliki gejala khusus dan hanya diketahui dengan mengukur tekanan darah.<br /><br />Apakah Sahabat Cimacan sudah mengetahui cara mengukur tekanan darah yang tepat? Yuk Mincan kasih info mengenai cara yang benar dan tepat..<br /><br />\r\n<ol>\r\n<li>Pasien dalam keadaan tenang</li>\r\n<li>Duduk dan istirahat selamat 3-5 menit sebelum dilakukan pengukuran tekanan darah</li>\r\n<li>Kandung kemih kosong (tidak sedang menahan buang air kecil)</li>\r\n<li>Hindari konsumsi kopi, alkohol, dan rokok minimal 30 menit sebelum pengukuran</li>\r\n<li>Posisi duduk bersandar dan rileks</li>\r\n<li>Posisi kaki tidak menyilang dan telapak kaki rata menyentuh lantai</li>\r\n<li>Lengan diposisikan di atas meja dengan ketinggian setara dengan posisi jantung</li>\r\n<li>Apabila menggunakan baju lengan panjang, usahakan lipatan baju tidak menghambat aliran darah</li>\r\n<li>Selama pengukuran dilangan berbicara dan bergerak</li>\r\n<li>Gunakan alat tensimeter yang tervalidasi</li>\r\n<li>Gunakan manset dengan ukuran sesuai dan posisi batas bawah manset sekitar 2,5cm di atas siku (2 jari di atas siku)</li>\r\n<li>Melakukan pengukuran tekanan darah sebanyak 2 kali dengan jeda 1-2 menit, serta pengukuran ke-3 (tambahan) apabila didapatkan perbedaan &gt;5 mmHg pada kedua pengukuran</li>\r\n<li>Hitung rerata tekanan darah</li>\r\n</ol>\r\n<br />Sumber:<br />World Health Organization<br />American Heart Association<br />Kementerian Kesehatan RI<br /><br />Instagram: <a title=\"@rsud.cimacan\" href=\"https://www.instagram.com/rsud.cimacan/\" target=\"_blank\" rel=\"noopener\">@rsud.cimacan</a>','Admin','article/20220518133104_mengukur-tekanan-darah-sendiri.jpg','publish','2022-05-18 13:32:50','2022-05-18 13:31:04'),(10,'Penyuluhan Demam Berdarah Rumah Sakit','Tim Promosi Kesehatan Rumah Sakit (PKRS) RSUD Cimacan telah melaksanakan penyuluhan di depan ruang poli klinik pada hari Senin, 11 Juli 2022.\r\nSosialisasi yang dilakukan memaparkan materi mengenai demam berdarah dengue kepada pengujung rsud cimacan','0GPDCIwX3W4boSlgOEjspLfr','Tim Promosi Kesehatan Rumah Sakit (PKRS) RSUD Cimacan telah melaksanakan penyuluhan di depan ruang poli klinik pada hari Senin, 11 Juli 2022.<br /><br />Sosialisasi yang dilakukan memaparkan materi mengenai demam berdarah dengue kepada pengujung rsud cimacan<br /><br />Penyuluhan ini senantiasa diharapkan dapat menambah khazanah ilmu pengetahuan serta pasien maupun keluarga pasien dapat mengaplikasikannya dengan baik.<br /><br />Sumber : <a title=\"Peyuluhan Demam Berdarah Dengue di depan ruang polklinik RSUD Cimacan\" href=\"https://www.instagram.com/p/Cf6QEBOhfgE/?utm_source=ig_web_copy_link\" target=\"_blank\" rel=\"noopener\">Peyuluhan Demam Berdarah Dengue di depan ruang polklinik RSUD Cimacan</a><br />Instagram : <a title=\"@rsud.cimacan\" href=\"https://www.instagram.com/rsud.cimacan/\" target=\"_blank\" rel=\"noopener\">@rsud.cimacan</a>','admin','article/20220714163217_sosialisasi-demam-berdarah-dengue.jpg','publish','2022-07-12 10:32:17','2022-07-14 16:32:17'),(11,'GEBYAR BAZAR UMKM HARI JADI CIANJUR 345','Direktur RSUD Cimacan, dr Juliana Aritonang, MARS dan tim memeriahkan Bazar UMKM di acara puncak Hari Jadi Cianjur ke-345 di Sindangbarang.','0GPDCIwX3W4boSlgOEjspLfr','pada hari Senin dan Selasa tanggal 11 - 12 Juli 2022<br />Direktur RSUD Cimacan dr. Juliana Aritonang, MARS dan tim memeriahkan Bazar UMKM di acara puncak Hari Jadi Cianjur ke-345 di Sindangbarang,<br />Acara ini diikuti oleh pegiat UMKM se-Kabupaten Cianjur yang akan mengikuti penilaian UMKM terbaik tingkat Kabupaten Cianjur.<br /><br />Yuk, cintai produk UMKM Cianjur. Bangga akan karya anak bangsa!!!<br /><br /><br />Sumber: <a title=\"RSUD Cimacan\" href=\"https://www.instagram.com/p/Cf8mHOnBLPn/?utm_source=ig_web_copy_link\" target=\"_blank\" rel=\"noopener\">RSUD Cimacan</a><br />Instagram : <a title=\"@rsud.cimacan\" href=\"https://www.instagram.com/rsud.cimacan/\" target=\"_blank\" rel=\"noopener\">@rsud.cimacan</a>','admin','article/20220714164031_cianjur-manjur-345.jpg','publish','2022-07-13 16:40:31','2022-07-14 16:40:31'),(12,'Cianjur Meraih Penghargaan WTP ke-3 Kalinya ','Selamat untuk Cianjur yang telah mendapatkan penghargaan WTP untuk ketiga kalinya secara berturut-turut sejak tahun 2019, 2020, hingga 2021.\r\n\r\nBak kado terindah, WTP ini diberikan bertepatan dengan Hari Jadi Cianjur ke-345.','0GPDCIwX3W4boSlgOEjspLfr','Selamat untuk Cianjur yang telah mendapatkan penghargaan WTP untuk ketiga kalinya secara berturut-turut sejak tahun 2019, 2020, hingga 2021.<br /><br />Bak kado terindah, WTP ini diberikan bertepatan dengan Hari Jadi Cianjur ke-345.<br /><br />Badan Pemeriksa Keuangan (BPK) Republik Indonesia Perwakilan Provinsi Jawa Barat diwakili oleh Kepala Subauditor Jabar III Nyra Yuliantina dan Kepala Sekretariat Perwakilan Jabar Yayat Rahadiat menyerahkan laporan hasil pemeriksaan keuangan Pemerintah Daerah Tahun Anggaran 2021, kepada Bupati Cianjur H. Herman Suherman bersama Ketua DPRD Kabupaten Cianjur Ganjar Ramadhan, Sekretaris Daerah Cianjur H. Cecep S. Alamsyah, Plt. Inspektur Inspektorat Cianjur Dedi Sudrajat dan Kepala BPKAD Cianjur Ahmad Danial.<br /><br />Apresiasi setinggi-tingginya untuk para ASN kabupaten Cianjur yang turut berpartipasi dalam meraih WTP ini dan juga kepada Dewan Perwakilan Rakyat Kabupaten Cianjur atas diraihnya WTP Cianjur ke 3.<br /><br />Sumber : <a title=\"Cianjur Merah Penghargaan WTP  ke-3 Kalinya\" href=\"https://www.instagram.com/p/CfxivEjBI1J/?utm_source=ig_web_copy_link\" target=\"_blank\" rel=\"noopener\">Cianjur Merah Penghargaan WTP ke-3 Kalinya</a><br />repost from : <a title=\"@h.hermansuherman\" href=\"https://www.instagram.com/h.hermansuherman/\" target=\"_blank\" rel=\"noopener\">@h.hermansuherman</a><br /><br />Instagram : <a title=\"@rsud.cimacan\" href=\"https://www.instagram.com/rsud.cimacan/\" target=\"_blank\" rel=\"noopener\">@rsud.cimacan</a>','admin','article/20220714164617_Penghargaan-WTP-ke-3.jpg','publish','2022-07-09 16:46:17','2022-07-14 16:46:17'),(13,'Fashion Show Hari Jadi Cianjur 345','pada hari Senin, 04 Juli 2022 RSUD Cimacan mengikuti lomba fashion show dalam rangka memperingati Hari Jadi Cianjur (HJC) ke-345, yang dilaksanakan di halaman SETDA Cianjur. Acara tersebut menampilkan busana yang berbahan dasar batik Cianjur.','0GPDCIwX3W4boSlgOEjspLfr','<p>Hallo Sahabat Cimacan,</p>\r\n<p>pada hari Senin, 04 Juli 2022 RSUD Cimacan mengikuti lomba <em>fashion show</em> dalam rangka memperingati Hari Jadi Cianjur (HJC) ke-345, yang dilaksanakan di halaman SETDA Cianjur. Acara tersebut menampilkan busana yang berbahan dasar batik Cianjur. Acara tersebut dimeriahkan oleh 32 Organisasi Perangkat Daerah (OPD) serta 32 Kecamatan di wilayah kabupaten Cianjur.<br />Setiap OPD dan Kecamatan mengirimkan perwakilan 3-5 orang untuk menampilkan busana di panggung HJC. Dengan mengusung tema Gema Kebudayaan Cianjur, diwakilkan langsung oleh Direktur RSUD Cimacan, dr Juliana Aritonang, MARS dan tim mempersembahkan batik yang sarat akan daerah Cianjur, yakni motif ayam pelung yang khas dengan keindahan suaranya, dipadu padankan denga ornamen lampu gentur, dan sentuhan akhir yaitu motif waditra tembang Cianjur kacapi dan gendang.</p>\r\n<p>Suatu kebanggaan menggunakan produk lokal merupakan upaya melestarikan budaya daerah Cianjur, serta membangkitkan semangat untuk lebih mencintai batik khas Indonesia.<br /><br />Sumber : <a title=\"Cimanews RSUD Cimacan\" href=\"https://www.instagram.com/p/Cfp8vOFhiY0/\" target=\"_blank\" rel=\"noopener\">Cimanews RSUD Cimacan</a><br />Instagram :&nbsp;<a title=\"@rsud.cimacan\" href=\"https://www.instagram.com/rsud.cimacan/\" target=\"_blank\" rel=\"noopener\">@rsud.cimacan</a></p>','admin','article/20220714201306_292276416_787683989270458_3018172056011200343_n.jpg','publish','2022-07-05 09:20:06','2022-07-14 20:13:06'),(14,'Lomba Memasak Hari Jadi Cianjur 345','Masih dalam rangkaian acara Hari Jadi Cianjur ke-345, lomba memasak diikuti oleh RSUD Cimacan sebagai salah satu Organisasi Perangkat Daerah (OPD) yang ada di kabupaten Cianjur.','0GPDCIwX3W4boSlgOEjspLfr','Hallo Sahabat Cimacan,<br /><br />Masih dalam rangkaian acara Hari Jadi Cianjur ke-345, lomba memasak diikuti oleh RSUD Cimacan sebagai salah satu Organisasi Perangkat Daerah (OPD) yang ada di kabupaten Cianjur.<br /><br />Dihadiri oleh Direktur RSUD Cimacan, dr Juliana Aritonang, MARS, lomba tersebut menggunakan bahan dasar kuliner Cianjur yang terkenal yakni tauco.<br /><br />Tauco merupakan fermentasi kacang kedelai yang diolah sedemikian rupa dan sering disandingkan dengan bahan makanan lainnya untuk menambah cita rasa yang khas.<br /><br />Dalam lomba memasak yang digelar di halaman Setda Cianjur kemarin pada hari, Selasa 5 Juli 2022, dr Juliana Aritonang, MARS menyuguhkan performa masaknya melalui makanan khas Cianjur Geco, yakni perpaduan Toge dan Tauco yang dikombinasi dengan kondimen-kondimen lainnya.<br /><br />Yuk coba kuliner Tauco Cianjur sebagai pelengkap kondimen untuk hidangan dirumah.<br /><br />Sumber : <a title=\"RSUD Cimacan\" href=\"https://www.instagram.com/p/Cfs0filBrUF/\" target=\"_blank\" rel=\"noopener\">RSUD Cimacan</a><br />Instagram : <a title=\"@rsud.cimacan\" href=\"https://www.instagram.com/rsud.cimacan/\" target=\"_blank\" rel=\"noopener\">@rsud.cimacan</a>','admin','article/20220715094945_CIMANEWS-lomba-memasak.png','publish','2022-07-06 09:49:45','2022-07-15 09:49:45'),(16,'TIPS HIDUP SEHAT','Yuk mulai konsisten dan perhatikan apa yang mesti kita persiapkan untuk tubuh kita, menyayangi diri sendiri dari mulai hal kecil.','EWc4aGs2mJrjY5LKOoT0gMXV','Hallo Sahabat Cimacan<br /><br />Sudah kah menerapkan pola makan sehat?<br /><br />Ternyata sangat berpengaruh lho terhadap faktor kesehatan kita.<br />Tips diatas bisa kita refleksikan dalam pola hidup sehat kita.<br /><br />Yuk mulai konsisten dan perhatikan apa yang mesti kita persiapkan untuk tubuh kita, menyayangi diri sendiri dari mulai hal kecil.','admin','article/20220729121004_280722.png','publish','2023-03-13 12:10:04','2022-07-29 12:10:04'),(17,'RSUD CIMACAN IMPLEMENTASIKAN ELECTRONIC MEDICAL RECORD','Electronic Medical Record (EMR) sudah diimplementasikan di Rumah Sakit Umum Daerah Cimacan pada hari Senin, 18 Juli 2022. ','0GPDCIwX3W4boSlgOEjspLfr','<em>Electronic Medical Record</em> (EMR) sudah diimplementasikan di Rumah Sakit Umum Daerah Cimacan pada hari Senin, 18 Juli 2022. mengingat sebelumnya telah dilaksanakan uji coba EMR selama dua minggu berturut-turut.<br /><br />Di era digital seperti sekarang ini, RSUD Cimacan mengoptimalkan pelayanan melalui EMR, untuk memudahkan pelayanan dalam hal pencatatan medis pasien.<br /><br />persiapan EMR dilakukan semaksimal mungkin oleh semua PPA di RSUD Cimacan untuk memaksimalkan tahapan demi tahapan menggunakan aplikasi ecalyptus. EMR ini diharapkan dapat menyimpan data lebih aman dengan tempat yang lebih sederhana dan setiap orang dapat merasakan manfaatnya.','admin','article/20220729121120_CIMANEWS-EMR.png','publish','2022-07-18 12:11:20','2022-07-18 12:11:20'),(18,'Pelatihan Basic Trauma Cardiac Life Support','Tingkatkan Kualitas Pelayanan: RSUD Cimacan Bekerja Sama dengan Gadar Medik Jakarta Laksanakan Pelatihan Basic Trauma Cardiac Life Support (BTCLS)','0GPDCIwX3W4boSlgOEjspLfr','Tingkatkan Kualitas Pelayanan: RSUD Cimacan Bekerja Sama dengan Gadar Medik Jakarta Laksanakan Pelatihan Basic Trauma Cardiac Life Support (BTCLS)<br /><br />Rumah Sakit Umum Daerah Cimacan melakukan pelatihan Basic Trauma Cardiac Life Support (BTCLS) bekerja sama dengan Gadar Medik Jakarta pada hari 09 Agustus 2020 sampai 12 Agustus 2022 bertempat di Gedung C Aula RSUD Cimacan.<br /><br />Tujuan diadakannya pelatihan tersebut, diharapkan kepala-kepala ruangan dan perawat pelaksana mampu melakukan penatalaksanaan kegawatdaruratan akibat trauma dan gangguan kardiovaskuler.<br /><br />Materi yang disampaikan dalam pelatihan tersebut terbagi menjadi materi dasar dan materi inti, peserta dibagi menjadi 4 kelompok untuk melaksanakan praktikum.<br /><br />Pelatihan Basic Trauma Cardiac Life Support (BTCLS) sesi pertama telah dilaksanakan dengan pemaparan materi Building Learning Centre, Etik dan Legal Aspek Keperawatan GADAR, Sistem Penanggulangan GADAR Terpadu (SPGDT), Bantuan Hidup Dasar (BHD), Penilaian Awal (Initial Assessment), Airway &amp; Breathing Management, Syok Management, serta Trauma Kepala &amp; Spinal.<br /><br />Diharapkan dengan kegiatan ini dapat meningkatkan kualitas pelayanan kegawatdaruratan dalam penanganan pasien secara cepat dan tepat.','admin','article/20220812095258_298219343_1192135318019296_5547488564316736463_n.jpg','publish','2022-08-09 09:52:58','2022-08-10 09:52:58'),(19,'Hari Ke-2 Pelatihan Basic Trauma Cardiac Life Support','Rabu, 10 Agustus 2022, telah dilaksanakan dengan pemaparan materi Refleksi Trauma Toraks dan Abdomen, Trauma Muskuloskeletal, Luka Bakar, Konsep Dasar EKG','0GPDCIwX3W4boSlgOEjspLfr','Pelatihan Basic Trauma Cardiac Life Support (BTCLS) sesi kedua pada hari Rabu, 10 Agustus 2022, telah dilaksanakan dengan pemaparan materi Refleksi Trauma Toraks dan Abdomen, Trauma Muskuloskeletal, Luka Bakar, Konsep Dasar EKG,<br />Acute Coronary Sindrom, Terapi Elektrik, Rujukan Pasien GADAR, Triase, dan Skill Station: BHD, Airway &amp; Breathing, Initial Assessment.<br /><br />Kegiatan ini akan terus berlangsung sampai pada penutupan acara di hari Jumat, 12 Agustus 2022.<br /><br />Dari pelatihan ini diharapkan dapat menambah khazanah keilmuan tenaga kesehatan dalam menangani kegawatdaruratan.','admin','article/20220812095516_btcls-(hari-ke-2).png','publish','2022-08-10 09:55:16','2022-08-11 09:55:16'),(20,'Pelatihan penggunaan APAR','Pelatihan penggunaan APAR sekaligus simulasi pemadaman kebakaran telah dilaksanakan oleh para pegawai RSUD Cimacan secara bergilir mengikuti jadwal shift pada hari Rabu, 10 Agustus 2022 bertempat di lapangan parkir gedung C (sebelah rumah dinas).','0GPDCIwX3W4boSlgOEjspLfr','Pelatihan penggunaan APAR sekaligus simulasi pemadaman kebakaran telah dilaksanakan oleh para pegawai RSUD Cimacan secara bergilir mengikuti jadwal shift pada hari Rabu, 10 Agustus 2022 bertempat di lapangan parkir gedung C (sebelah rumah dinas).<br /><br />Acara ini dimulai dari pukul 08.30-14.00 wib terbagi menjadi 4 gelombang, setiap gelombang berdurasi selama 1 jam.<br /><br />Diadakannya pelatihan ini diharapkan nakes dan non nakes RSUD Cimacan dapat menanggulangi kebakaran dalam skala kecil.','admin','article/20220812095848_298146239_1705391783175854_6582818654721159513_n.jpg','publish','2022-08-10 09:58:48','2022-08-12 09:58:48'),(21,'Workshop dan Best Practice Implementasi RSSIB','Workshop dan Best Practice Implementasi Rumah Sakit Sayang Ibu dan Bayi (RSSIB), telah dilaksanakan oleh perwakilan petugas calon tim RSSIB dari RSUD Sayang, RSUD Cimacan, dan RSUD Pagelaran pada hari Rabu, 10 Agustus 2022. Bertempat di Aula RSUD Say','0GPDCIwX3W4boSlgOEjspLfr','Workshop dan Best Practice Implementasi Rumah Sakit Sayang Ibu dan Bayi (RSSIB), telah dilaksanakan oleh perwakilan petugas calon tim RSSIB dari RSUD Sayang, RSUD Cimacan, dan RSUD Pagelaran pada hari Rabu, 10 Agustus 2022. Bertempat di Aula RSUD Sayang.<br /><br />Kegiatan RSSIB tersebut dilaksanakan guna mendukung kebijakan daerah dalam upaya percepatan penurunan kematian ibu dan bayi di Kabupaten Cianjur.<br /><br />Berlangsung dari pukul 08.30-13.00 WIB, acara tersebut diharapkan dapat mengentaskan permasalahan di Kabupaten Cianjur terutama kematian ibu dan bayi, dengan menerapkan konsep Rumah Sakit Sayang Ibu dan Bayi.','admin','article/20220818115627_RSSIB.png','publish','2022-08-11 11:56:27','2022-08-12 11:56:27'),(22,'Upacara Bendera Hari Kemerdekaan RI ke-77','Dalam rangka turut serta memperingati Hari Kemerdekaan Republik Indonesia ke-77, RSUD Cimacan melaksanakan kegiatan Upacara Bendera pada pukul 07.30 WIB.','0GPDCIwX3W4boSlgOEjspLfr','Dalam rangka turut serta memperingati Hari Kemerdekaan Republik Indonesia ke-77, RSUD Cimacan melaksanakan kegiatan Upacara Bendera pada pukul 07.30 WIB. Kegiatan ini diikuti oleh seluruh keluarga besar RSUD Cimacan.<br /><br />Berbeda dari tahun sebelumnya, Upacara Bendera tahun ini dilaksanakan di halaman Gedung RSUD Cimacan, Bapak Hasan Fuad, S.Kep NERS, selaku Inspektur Upacara memimpin kegiatan Upacara Bendera dengan penuh hikmat.<br /><br />RSUD Cimacan mengucapkan Dirgahayu Republik Indonesia ke-77<br />Semoga Indonesia dapat Pulih Lebih Cepat dan Bangkit Lebih Kuat!','admin','article/20220818115939_299522191_409463134501938_6525163181138102932_n.webp','publish','2022-08-17 11:59:39','2022-08-18 11:59:39'),(23,'Prosesi Upacara Penurunan Bendera','keluarga besar RSUD Cimacan beserta Dokter dan tenaga kesehatan lainnya mengikuti prosesi Upacara Penurunan Bendera Merah Putih secara virtual dari Istana Merdeka, Jakarta.','0GPDCIwX3W4boSlgOEjspLfr','Rabu, 17 Agustus 2022, keluarga besar RSUD Cimacan beserta Dokter dan tenaga kesehatan lainnya mengikuti prosesi Upacara Penurunan Bendera Merah Putih secara virtual dari Istana Merdeka, Jakarta.<br /><br />Walaupun diikuti secara daring, prosesi Upacara Penurunan Bendera berjalan lancar dan khidmat.<br /><br />Selamat merayakan Hari Kemerdekaan RI untuk kita semua, semoga hari ini menjadi momentum kebangkitan Indonesia &amp; memberikan semangat baru untuk seluruh masyarakat.','admin','article/20220818120105_299607845_636429340989886_5019383853585959297_n.webp','publish','2022-08-17 12:01:05','2022-08-18 12:01:05'),(24,'Hari Ke-3 pelatihan Basic trauma cardiac life support','telah dilaksanakan dengan pemaparan materi mengenai Refleksi, Building Learning Commitment (BLC), Etik dan Legal Aspek Keperawatan GADAR, Sistem Penanggulangan GADAR Terpadu (SPGDT), Bantuan Hidup Dasar (BHD)','0GPDCIwX3W4boSlgOEjspLfr','Pelatihan Basic Trauma Cardiac Life Support (BTCLS) sesi ketiga pada hari Kamis 11 Agustus 2022, telah dilaksanakan dengan pemaparan materi mengenai Refleksi, Building Learning Commitment (BLC), Etik dan Legal Aspek Keperawatan GADAR, Sistem Penanggulangan GADAR Terpadu (SPGDT), Bantuan Hidup Dasar (BHD)<br />Penilaian Awal (Initial Assessment), Airway &amp; Breathing Management, Syok Management<br />Trauma Kepala &amp; Spinal,<br />Skill Station: BHD, Airway &amp; Breathing, Initial Assessment<br />Istirahat,<br />Skill Station: BHD, Airway &amp; Breathing, Initial Assessment,<br />Skill Station: BHD, Airway &amp; Breathing, Initial Assessment<br />Skill Station: Terapi Elektrik, Stab. Spinal, Stab. Muskulosklelatal.<br /><br />Kegiatan ini akan berakhir pada hari Jumat, 12 Agustus 2022, dengan tambahan materi mengenai Skill Station: Terapi Elektrik, Stab. Spinal, Stab. Muskulosklelatal.<br /><br />Hadirnya pelatihan ini diharapkan dapat menambah khazanah keilmuan tenaga kesehatan Rumah Sakit Umum Daerah Cimacan untuk menangani kegawatdaruratan.','admin','article/20220818121208_btcls-(hari-ke-3).png','publish','2022-08-11 12:12:08','2022-08-12 12:12:08'),(25,'Hari Ke-4 pelatihan basic trauma cardiac life support','Pelatihan Basic Trauma Cardiac Life Support (BTCLS) sesi terakhir pada hari Jumat 12 Agustus 2022, telah dilaksanakan.','0GPDCIwX3W4boSlgOEjspLfr','Pelatihan Basic Trauma Cardiac Life Support (BTCLS) sesi terakhir pada hari Jumat 12 Agustus 2022, telah dilaksanakan.<br /><br />Materi terakhir dalam kegiatan tersebut mengenai<br />Skill Station: Terapi Elektrik, Stab. Spinal, Stab. Muskulosklelatal. Selanjutnya disambung dengan sesi ujian yang dilaksanakan dari pukul 11.15-16.30 wib di gedung C, RSUD Cimacan.<br /><br />Dengan diadakannya pelatihan BTCLS ini, diharapkan dapat meningkatkan cakrawala ilmu pengetahuan bagi tenaga kesehatan Rumah Sakit Umum Daerah Cimacan dalam menangani kegawatdaruratan.','admin','article/20220818121303_btcls-(hari-ke-4).png','publish','2022-08-12 12:13:03','2022-08-14 12:13:03'),(26,'optimalkan penggunaan EMR Ecalyptus','Rumah Sakit Umum Daerah Cimacan ','0GPDCIwX3W4boSlgOEjspLfr','Rumah Sakit Umum Daerah Cimacan melaksanakan kegiatan simulasi evaluasi serta pemantapan Implementasi Electronic Medical Record (EMR) Ecalyptus di aula gedung C RSUD Cimacan, dalam rangka memaksimalkan implementasi penggunaan EMR.<br /><br />Acara tersebut digelar pada hari Selasa dan Kamis, tanggal 16 dan 18 Agustus 2022, Untuk rangkaian sesi implementasi tersendiri diberlakukan menjadi 2 bagian yaitu, sesi 1 dari pukul 08.00 sampai dengan 10.00 WIB, kemudian sesi 2 dari pukul 10.30 dan selesai pukul 12.30 WIB.<br /><br />Peserta yang hadir dalam kegiatan tersebut diantaranya Dokter Umum IGD dan Ruangan, Kepala Ruangan dan PPJA IGD serta rawat inap,Kepala Bidang Pelayanan Medis atau perwakilan, Kepala Bidang Keperawatan atau perwakilan, Tim Ad Hoc EMR, juga Tim EMR Ecalyptus Buana.<br /><br />Terlaksananya acara tersebut diharapkan dapat mengoptimalkan penggunaan EMR oleh pelayan kesehatan sehingga dapat meningkatkan kecepatan dan kualitas layanan rumah sakit.','admin','article/20221018134334_299774149_429561229145836_7709210587097577906_n.jpg','publish','2022-08-18 13:43:34','2022-10-18 13:43:34'),(29,'penghargaan kepada pasien hemodialisa','Direktur RSUD Cimacan, dr. Juliana Aritonang, MARS, secara langsung memberikan penghargaan kepada beberapa pasien hemodialisa yang memiliki hemoglobin tinggi. Kegiatan berlangsung di ruang hemodialisa RSUD Cimacan\r\n','0GPDCIwX3W4boSlgOEjspLfr','Direktur RSUD Cimacan, dr. Juliana Aritonang, MARS, secara langsung memberikan penghargaan kepada beberapa pasien hemodialisa yang memiliki hemoglobin tinggi. Kegiatan berlangsung di ruang hemodialisa RSUD Cimacan<br /><br />Penghargaan ini dilakukan untuk memberikan apresiasi kepada pasien-pasien hemodialisa yang rutin berobat dan menjaga kesehatan sehingga memiliki hemoglobin tinggi.<br />Rencananya kegiatan ini akan dilakukan tiap 6 bulan dengan tujuan memberikan motivasi dan semangat kepada pasien hemodialisa','admin','article/20221019084026_307835437_644162257129808_5724915852652023197_n.jpg','publish','2022-09-09 08:40:26','2022-10-19 08:40:26'),(31,'kegiatan Bakti Sosial Cianjur Bangkit','Direktur RSUD Cimacan, dr. Juliana Aritonang, MARS menghadiri kegiatan Bakti Sosial Cianjur Bangkit Bersama Rakyat di Desa Benjot, Kecamatan Cugenang, Kabupaten Cianjur. ','0GPDCIwX3W4boSlgOEjspLfr','Direktur RSUD Cimacan, dr. Juliana Aritonang, MARS menghadiri kegiatan Bakti Sosial Cianjur Bangkit Bersama Rakyat di Desa Benjot, Kecamatan Cugenang, Kabupaten Cianjur.&nbsp;<br /><br />Acara tersebut berlangsung pada hari Rabu, 11 januari 2022 &nbsp;diikuti oleh warga yang terdampak gempa bumi 5.6 SR pada tanggal 21 November 2022.&nbsp;<br /><br />Digelarnya kegiatan baksos ini diharapkan dapat membantu memulihkan saudara-saudara kita yang terkena musibah, dan &nbsp;bangkit kembali menata hidup yang lebih baik.<br /><br />#Cianjur<br />#Cianjurmanjur<br />#RsudCimacan<br />#Cimanews&nbsp;<br /><br />@h.hermansuherman&nbsp;<br />@tbmulyana_official&nbsp;<br />@juliana__aritonang&nbsp;<br />@dinkeskabcianjur&nbsp;<br />@rsudpagelarancianjur&nbsp;<br />@rsudsayang.someah&nbsp;<br />@setda_cianjur&nbsp;<br />@pemkabcjr&nbsp;<br />@diskominfocianjur&nbsp;<br />@disdukcapilcianjur&nbsp;<br />@dishub_cianjur&nbsp;<br />@disnakertranscianjur&nbsp;<br />@disbudpar.cianjur&nbsp;<br />@diskuperdagin.cianjur&nbsp;<br />@disnakkeswankan.cianjur&nbsp;<br />@disarpus_cianjur&nbsp;<br />@infocianjur&nbsp;<br />@infocipanas_&nbsp;<br />@infocianjurutara&nbsp;<br />@desa_cipanas&nbsp;<br />@desakucimacan&nbsp;<br />@pemdes_gadog&nbsp;<br />@desaciloto&nbsp;<br />@pkm_cipanas&nbsp;<br />@pkmpacet&nbsp;<br />@pkmsukanagalih<br />https://www.instagram.com/p/CnRWrWxh5Wr/?igshid=MDJmNzVkMjY=','admin','article/20230113073726_324858559_705775871254181_7970070128167521815_n.jpg','publish','2023-01-13 07:37:26','2023-01-13 07:37:26'),(32,'Bakti Sosial Cianjur Bangkit Bersama Rakyat','Bupati Cianjur, H. Herman Suherman bersama Direktur RSUD Cimacan, dr. Juliana Aritonang, MARS menghadiri acara Bakti Sosial Cianjur Bangkit Bersama Rakyat, pada hari Jumat, 13 Januari 2023.','0GPDCIwX3W4boSlgOEjspLfr','Bupati Cianjur, H. Herman Suherman bersama Direktur RSUD Cimacan, dr. Juliana Aritonang, MARS menghadiri acara Bakti Sosial Cianjur Bangkit Bersama Rakyat, pada hari Jumat, 13 Januari 2023.<br /><br />Berlangsung di Desa Gasol Kecamatan Cugenang, kegiatan tersebut juga dihadiri oleh seluruh kepala organisasi perangkat daerah Cianjur.<br /><br />Dengan adanya kegiatan tersebut diharapkan, dapat membantu saudara-saudara kita yang terdampak oleh bencana gempa, dan selalu diberi kekuatan untuk tetap menjalani hidup dan bangkit dari keterpurukan.','admin','article/20230116101114_324705286_523622843082211_4110712754406104579_n.jpg','publish','2023-01-16 10:11:14','2023-01-16 10:11:14'),(36,'Pelayanan Medical Emergency Support Team','Medical Emergency Support Team (MEST) bersama Rumah Sakit Umum Daerah Cimacan pada hari Minggu, 15 Januari 2022 bertempat di Desa Sarampad, Kecamatan Cugenang, Kabupaten Cianjur.','0GPDCIwX3W4boSlgOEjspLfr','Medical Emergency Support Team (MEST) bersama Rumah Sakit Umum Daerah Cimacan pada hari Minggu, 15 Januari 2022 bertempat di Desa Sarampad, Kecamatan Cugenang, Kabupaten Cianjur.<br /><br />Kegiatan tersebut meliputi pelayanan spesialistik penyakit dalam, Anak, Saraf, Bedah, Jiwa, THT, Mata, serta disediakannya khitanan massal, pemeriksaan dan USG kehamilan.<br /><br />Acara tersebut terselenggara dalam rangka Peduli Cianjur Bangkit terhadap penyintas gempa bumi Cianjur 5.6 SR, diharapkan dapat membantu dan kembali menumbuhkan semangat untuk saudara-saudara kita di Cianjur.','admin','article/20230329153129_325673468_873098853911533_564911436276275993_n.jpg','publish','2023-01-16 15:31:29','2023-03-29 15:31:29'),(37,'cara menjaga kesehatan mata','Selamat Malam Sobat Cimacan!... Kali ini Mincan akan spill cara menjaga kesehatan mata!','EWc4aGs2mJrjY5LKOoT0gMXV','Selamat Malam Sobat Cimacan!<br /><br />Kali ini Mincan akan spill cara menjaga kesehatan mata!<br /><br />ada yang belum pernah periksa mata ke dokter mata? Ternyata penting lho memeriksakan kesehatan mata kita setiap 2 tahun sekali, karena seiring bertambahnya usia, apalagi pasien rentan seperti lansia butuh deteksi sejak dini agar kita mengetahui penyakit yang diderita melalui pemeriksaan mata kita. Seperti adanya Glukoma, tekanan darah tinggi, diabetes, degenerasi makula, dan katarak.<br /><br />Jika kita memiliki riwayat penyakit mata genetik, dokter mata dapat mendeteksi lebih awal dan kita pun dapat mencegah sejak dini.<br /><br />Jangan takut periksakan mata untuk menjaga kesehatan mata kita, yuk datang ke poli mata RSUD Cimacan, mencegah lebih baik dari pada mengobati!','admin','article/20230329153821_325914729_886090422739460_62025956605150578_n.jpg','publish','2023-03-15 15:38:21','2023-03-29 15:38:21'),(38,' Hari Gizi Nasional ke-63 ','Dalam rangka Hari Gizi Nasional ke-63 yang dilaksanakan hari Rabu, 25 Januari 2023, tim PKRS RSUD Cimacan mengadakan Penyuluhan Pencegahan Stunting.','0GPDCIwX3W4boSlgOEjspLfr','Dalam rangka Hari Gizi Nasional ke-63 yang dilaksanakan hari Rabu, 25 Januari 2023, tim PKRS RSUD Cimacan mengadakan Penyuluhan Pencegahan Stunting.<br /><br />Kegiatan tersebut dilaksanakan di ruang tunggu poli anak, dan melibatkan orang tua dan pasien anak.','admin','article/20230329154148_327094123_501729695410172_322173345682307534_n.jpg','publish','2023-01-26 15:41:48','2023-03-29 15:41:48'),(39,'Campak','Hallo Sobat Cimacan!\r\n\r\nCampak merupakan penyakit menular yang disebabkan oleh virus dari keluarga paramyxovirus.\r\n\r\nKenapa bisa menular? perlu Sobat Cimacan ketahui, penularan virus campak ini melalui percikan air liur dan benda yang terkontaminasi viru','EWc4aGs2mJrjY5LKOoT0gMXV','Hallo Sobat Cimacan!<br /><br />Campak merupakan penyakit menular yang disebabkan oleh virus dari keluarga paramyxovirus.<br /><br />Kenapa bisa menular? perlu Sobat Cimacan ketahui, penularan virus campak ini melalui percikan air liur dan benda yang terkontaminasi virus tersebut.<br /><br />Tanda-tanda orang terkena virus campak ialah:<br />1. Demam tinggi<br />2. Batuk Pilek<br />3. Mata Berair<br />4. Timbul bintik<br /><br />Selalu cek kesehatan tubuh kita sejak dini, untuk menghindari komplikasi lebih lanjut!','admin','article/20230330080635_327958738_191211643519257_1796186254967822428_n.jpg','publish','2023-03-16 08:06:35','2023-03-30 08:06:35'),(40,'menjaga kesehatan reproduksi','Hallo Sobat Cimacan! Yakin gak sih kalian sudah menjaga kesehatan reproduksi kalian dengan baik?','AEx5ug1DFMJjsyX8YIGRTnm7','Hallo Sobat Cimacan!<br /><br />Yakin gak sih kalian sudah menjaga kesehatan reproduksi kalian dengan baik?<br /><br />Kesehatan reproduksi berpengaruh pada kesehatan fisik, psikis, sosial tidak terlepas pula pada penyakit dan kecacatan dari organ reproduksi itu sendiri.<br /><br />Perkembang biakan bakteri akan lebih pesat ketika membiarkan organ reproduksi kita lembab dan tidak terjaga.<br /><br />Mulai dari sekarang, yuk jaga kesehatan reproduksi kita dengan menjalankan tips sederhana dari mincan!<br /><br />memang kadang malas dan bosan tetapi kalo bukan kita siapa lagi yang akan menjaga diri kita sendiri?','admin','article/20230330080926_329228036_687760473134943_8110748327711929496_n.jpg','publish','2023-03-14 08:09:26','2023-03-30 08:09:26'),(41,'Sosialisasi layanan kesehatan dan penyuluhan kesehatan gigi','Sosialisasi terkait layanan kesehatan dan penyuluhan kesehatan gigi serta mulut dilaksanakan oleh tim PKRS Cimacan pada hari Kamis, 09 Februari 2023.','0GPDCIwX3W4boSlgOEjspLfr','Sosialisasi terkait layanan kesehatan dan penyuluhan kesehatan gigi serta mulut dilaksanakan oleh tim PKRS Cimacan pada hari Kamis, 09 Februari 2023.<br /><br />Bertempat di SLB Purnama Cipanas, kegiatan tersebut dihadiri oleh 50 orang peserta. dengan terlaksananya penyuluhan tersebut diharapkan dapat meningkatkan kesadaran akan kesehatan diri sendiri, serta mengajak masyarakat untuk lebih awal memeriksa kesehatan ke faskes terdekat.','admin','article/20230330081222_329710160_1921307671546684_3987616783842245637_n.jpg','publish','2023-02-10 08:12:22','2023-03-30 08:12:22'),(42,'Human Immunodefeciency Virus','Hallo Sobat Cimacan!... HIV (Human Immunodefeciency Virus) merupakan penyakit berbahaya yang menyerang kekebalan imun tubuh manusia.','EWc4aGs2mJrjY5LKOoT0gMXV','Hallo Sobat Cimacan!<br /><br />HIV (Human Immunodefeciency Virus) merupakan penyakit berbahaya yang menyerang kekebalan imun tubuh manusia.<br /><br />Harap berhati-hati dan selalu mengedukasi sekitar kita terkait bahayanya penyakit tersebut.<br /><br />Kenali penyakitnya dan cegah penularannya!','admin','article/20230330081517_330675651_555583356521193_6268589117865719417_n.jpg','publish','2023-03-17 08:15:17','2023-03-30 08:15:17'),(43,'Penyuluhan stunting','Penyuluhan stunting telah dilaksanakan pada hari Jumat, 17 Februari 2023 bertempat di Aula Gedung C RSUD Cimacan.','0GPDCIwX3W4boSlgOEjspLfr','Penyuluhan stunting telah dilaksanakan pada hari Jumat, 17 Februari 2023 bertempat di Aula Gedung C RSUD Cimacan.<br /><br />Sosialisasi tersebut dihadiri oleh bidan, perawat, serta dokter-dokter yang dipimpin langsung oleh dr. Yonita Aprilia, Sp. A dan dr. Marisha.<br /><br />semoga acara penyuluhan tersebut dapat menambah khazanah keilmuan nakes RSUD Cimacan.','admin','article/20230330082143_331356603_737354484710558_4850261555577413905_n.jpg','publish','2023-02-18 08:21:43','2023-03-30 08:21:43'),(44,'Pelaksanaan sosialisasi mobile JKN dan Antrian Online','Pelaksanaan sosialisasi mobile JKN dan Antrian Online dilaksanakan hari Senin, 20 Februari 2023 di Aula Gedung C RSUD Cimacan.','0GPDCIwX3W4boSlgOEjspLfr','Pelaksanaan sosialisasi mobile JKN dan Antrian Online dilaksanakan hari Senin, 20 Februari 2023 di Aula Gedung C RSUD Cimacan.<br /><br />kegiatan ini diikuti oleh seluruh kepala ruangan, kepala instalasi, admisi, serta admin ruangan guna menyampaikan penggunaan JKN Mobile dan Antrian Online.','admin','article/20230330082552_332071644_1676098139508752_8297945299525399360_n.jpg','publish','2023-02-20 08:25:52','2023-03-30 08:25:52'),(46,'Penyuluhan kesehatan','Hallo Sobat Cimacan, Sudahkah kamu tau? Penyuluhan kesehatan kerap kali dilaksanakan oleh tim PKRS RSUD Cimacan lho Sobat!','0GPDCIwX3W4boSlgOEjspLfr','Hallo Sobat Cimacan, Sudahkah kamu tau? Penyuluhan kesehatan kerap kali dilaksanakan oleh tim PKRS RSUD Cimacan lho Sobat!<br /><br />Untuk kesempatan sosialisasi pada hari Selasa, 08 Maret 2023 bertempat di Kantor Desa Cipanas, dihadiri oleh Kepala Desa Cipanas, Agus Syahputra serta jajaran kader desa Cipanas.<br /><br />Dalam kegiatan tersebut, Tim PKRS Cimacan menyampaikan terkait layanan dan fasilitas kesehatan yang dapat dinikmati oleh masyarakat, serta berbagi pengalaman terkait permasalahan layanan pendaftaran yang langsung ditanggapi oleh tim penyuluhan.','admin','article/20230330083102_334704898_1410846019735390_3402166042865422560_n.jpg','publish','2023-03-08 08:31:02','2023-03-30 08:31:02'),(47,'Peresmian Gedung C Cimacan','Bupati Cianjur, H. Herman Suherman resmikan Gedung C serta Ruang Perawatan RSUD Cimacan.','0GPDCIwX3W4boSlgOEjspLfr','Bupati Cianjur, H. Herman Suherman resmikan Gedung C serta Ruang Perawatan RSUD Cimacan.<br /><br />Hari Jumat, 10 Maret 2023 Bupati Cianjur, H. Herman Suherman telah meresmikan Gedung C serta Ruang Perawatan RSUD Cimacan.<br /><br />Peresmian tersebut dilaksanakan melalui penandatanganan prasasti, didampingi oleh Sekretaris Daerah Cianjur, Cecep S Alamsyah, serta Direktur RSUD Cimacan, dr. Juliana Aritonang, MARS<br /><br />Adapun, harapan yang disampaikan oleh Bupati yakni harus meningkatkan implementasi motto \"Melayani dengan Hati dan Cinta,\" tidak hanya pelayanan di gedung C tetapi juga melayani dengan baik disegala aspek pelayanan di RSUD Cimacan.<br /><br />Kini gedung RSUD Cimacan, terdiri dari 4 Gedung utama. Diantaranya, Gedungpelayanan IGD Ponek, VK Ruang bersalin, Ruang perawatan ibu dan bayi, ruang khusus isolasi. Kemudian, Gedung A yang meliputi gedung pelayanan IGD, Radiologi, Laboratorium, Ruang bedah sentral, HCU/ICU, dan Gedung B berupa poliklinik, selanjutnya terdapat gedung yang baru saja diresmikan, yakni Gedung C yang memiliki bagian ruang perawatan kelas I, II, III, VIP, VVIP, dan president suite, yang terakhir adalah ruang manajemen.<br /><br />Acara tersebut berlangsung dengan khidmat dan mendapatkan antusias yang luar biasa dari masyarakat.','admin','article/20230330083705_334600174_906790620523668_8540764311438348077_n.jpg','publish','2023-03-10 08:37:05','2023-03-30 08:37:05'),(48,'Waspada Campak Pada Anak!','Waspada Campak Pada Anak!\r\n\r\nPerlu Sobat Cimacan tau, Campak merupakan virus berbahaya yang berasal dari virus RNA dari genus Morbilivirus dari keluarga Paramyxoviridae.\r\n\r\nVirus campak ini begitu berbahaya dibanding di campakan oleh kekasih, hehe\r\n\r\nkena','8achmr6KSCqQVAiIefxJOLl3','Waspada Campak Pada Anak!<br /><br />Perlu Sobat Cimacan tau, Campak merupakan virus berbahaya yang berasal dari virus RNA dari genus Morbilivirus dari keluarga Paramyxoviridae.<br /><br />Virus campak ini begitu berbahaya dibanding di campakan oleh kekasih, hehe<br /><br />kenapa berbahaya?<br /><br />Kemenkes mencatat pada tahun 2021 kasus campak berjumlah 132 orang, sementara pada tahun 2022 melonjak menjadi 3341 kasus alias ada peningkatan 25 kali lipat.<br /><br />31 provinsi di Indonesia telah melaporkan ribuan temuan kasus campak, dengan 12 provinsi di antaranya sudah menetapkan status Kejadian Luar Biasa (KLB).<br /><br />Penularannya pun sangat signifikan, melalui droplet yang keluar dari hidung, mulut, atau tenggorokan orang yang terinfeksi virus tersebut.<br /><br />Maka dari itu, yuk untuk lebih memperhatikan kesehatan diri dan keluarga agar selalu waspada terhadap virus berbahaya campak. Segera periksakan ke faskes terdekat jika mengalami gejala dari virus tersebut, cegah dengan vaksin atau imunisasi campak.','admin','article/20230330083927_336049068_614252817232287_4870214506673261123_n.jpg','publish','2023-03-18 08:39:27','2023-03-30 08:39:27'),(49,'laporan evaluasi kinerja serta rencana kerja rumah sakit','laporan evaluasi kinerja rumah sakit dan komite mutu tahun 2022 serta rencana kerja rumah sakit tahun 2023','0GPDCIwX3W4boSlgOEjspLfr','laporan evaluasi kinerja rumah sakit dan komite mutu tahun 2022 serta rencana kerja rumah sakit tahun 2023<br /><br />Selasa, 21 Maret 2023 telah berlangsung kegiatan laporan evaluasi tahun 2022 dan rencana kerja rumah sakit tahun 2023.<br /><br />Kegiatan ini dihadiri oleh dewan pengawas rumah sakit, seluruh jajaran struktural rumah sakit serta komite rumah sakit umum daerah cimacan.<br /><br />Dalam agenda hari ini dilakukan pemaparan oleh komite mutu terkait capaian-capaian indikator mutu rumah sakit, standar pelayanan minimal, insiden keselamatan pasien, survei kepuasan masyarakat serta manajemen risiko.<br /><br />Selain itu, rapat hari ini juga menyampaikan capaian rumah sakit selama tahun 2022 antara lain adanya peningkatan jumlah kunjungan pasien yang meningkat dari tahun 2020 sampai 2022.<br /><br />RSUD Cimacan sudah menerapkan Elektronik Medical Record. Serta RSUD Cimacan yang sudah terakreditasi paripurna ditahun 2022.<br /><br />Besar harapan dari dewan pengawas agar RSUD Cimacan semakin berinovasi kedepannya dan tetap menjaga mutu serta kualitas pelayanan.','admin','article/20230330084448_337318857_228841459674285_2966132954787066173_n.jpg','publish','2023-03-21 08:44:48','2023-03-30 08:44:48'),(50,'sosialisasi promosi layanan kesehatan','sosialisasi promosi layanan kesehatan','0GPDCIwX3W4boSlgOEjspLfr','Pelaksanaan sosialisasi promosi layanan kesehatan dilaksanakan pada hari Rabu, 05 April 2023 bertempat di Aula Desa Ciloto.<br /><br />Kegiatan rutin tersebut dilakukan oleh Tim PKRS RSUD Cimacan bekerjasama dengan Ketua Tim Mutu dr. Shelly Silvia Bintang dan Kepala Seksi Pelayanan Medik dr. Hani Adiswasani Budhi K.<br /><br />Dalam sosialisasi dipaparkan terkait layanan kesehatan dimulai dari fasilitas, jadwal dokter, dokter spesialis, layanan unggulan serta pelayanan jaminan BPJS.<br /><br />Animo masyarakat nampak hadir saat sesi tanya jawab berlangsung, acara tersebut dihadiri oleh Kepala Desa Ciloto, Sekretaris Desa Ciloto, serta elemen masyarakat lainnya.<br /><br />Hadirnya sosialisasi dari tim RSUD Cimacan diharapkan dapat meningkatkan kepercayaan masyarakat terhadap pelayanan rumah sakit yang dekat dengan masyarakat.','admin','article/20230406101429_339353004_808084517314425_7428058187440801104_n.jpg','publish','2023-04-06 10:14:29','2023-04-06 10:14:29'),(51,'Optimalisasi Pemanfaatan Mobile JKN serta Kordinasi Rujukan Pasien','Mobile JKN','0GPDCIwX3W4boSlgOEjspLfr','Sosialisasi pemanfaatan antrian Mobile JKN dilaksanakan pada hari Senin, 10 April 2023 oleh Tim Mutu Layanan Fasilitas Kesehatan BPJS Kesehatan bekerja sama dengan Tim Pelayanan Medik RSUD Cimacan bertempat di Aula Gedung C RSUD Cimacan.<br /><br />kegiatan tersebut dihadiri oleh Puskemas dan Klinik wilayah yang bekerjasama dengan RSUD Cimacan.<br /><br />Tim Mutu Layanan Fasilitas Kesehatan BPJS Kesehatan, Dwi Ayu Larasati menerangkan terkait keluhan pendaftaran melalui JKN Mobile, indikator keberhasilan yaitu kemudahan dalam proses antrian , tidak ada penumpukan pasien dan singkatnya waktu tunggu pelayananan<br /><br />Selain itu, Tim Pelayanan Medik, dr. Hani Adiswasani Budhi K memaparkan terkait alur rawat jalan yang dilakukan pasien ada yang mendaftar sendiri ke RS, ada pula yang online melalui aplikasi Tartimah dan Mobile JKN.<br /><br />Perbandingan Tartimah dan Mobile JKN seringkali dipilih oleh pasien tergantung kemudahannya.<br /><br />Adanya kegiatan tersebut diharapkan agar pasien BPJS bisa memulai reservasi online melalui Mobile JKN dengan diarahkan diaplikasi tersebut secara bertahap.','admin','article/20230515085902_340480454_183261041235428_5345151591941097378_n.jpg','publish','2023-04-10 08:59:02','2023-04-10 08:59:02'),(52,'Halal Bihalal Idul Fitri 1444 H','Tim RSUD Cimacan Menghadiri Undangan Halal Bihalal yang menjadi ajang silaturahmi bersama Bapak Bupati Cianjur, H.Herman Suherman beserta seluruh OPD Kab. Cianjur bertempat di Pendopo Cianjur pada hari Selasa, 2 Mei 2023.','0GPDCIwX3W4boSlgOEjspLfr','Tim RSUD Cimacan Menghadiri Undangan Halal Bihalal yang menjadi ajang silaturahmi bersama Bapak Bupati Cianjur, H.Herman Suherman beserta seluruh OPD Kab. Cianjur bertempat di Pendopo Cianjur pada hari Selasa, 2 Mei 2023.<br /><br />Halal bihalal merupakan momen membahagiakan untuk menjaga silaturahmi untuk membangkitkan rasa saling memaafkan.<br /><br />Semoga momen ini, kita semua senantiasa dikarunai keikhlasan untuk saling memaafkan atas semua dosa dan kesalahan satu sama lain. Aamiin.<br /><br />Taqabalallahu Minna wa Minkum wa Taqabbal ya Taqabbal ya Karim.','admin','article/20230515092648_344200423_6193824674065901_7031808863624420952_n.jpg','publish','2023-05-03 09:26:48','2023-05-03 09:26:48'),(53,'sosialisasi layanan kesehatan','Pelaksanaan sosialisasi layanan kesehatan dilaksanakan pada hari Rabu, 10 Mei 2023 bertempat di Aula Desa Sindangjaya.','0GPDCIwX3W4boSlgOEjspLfr','Pelaksanaan sosialisasi layanan kesehatan dilaksanakan pada hari Rabu, 10 Mei 2023 bertempat di Aula Desa Sindangjaya.<br /><br />Kegiatan rutin tersebut dilakukan oleh Tim PKRS RSUD Cimacan bekerjasama dengan Kepala Seksi Pelayanan Medik dr. Hani Adiswasani Budhi K.<br /><br />Dalam sosialisasi dipaparkan terkait layanan kesehatan dimulai dari fasilitas, jadwal dokter, dokter spesialis, layanan unggulan serta pelayanan jaminan BPJS.<br /><br />Antusiasme masyarakat terhadap penyuluhan sangatlah tinggi, hal ini terlihat pada sesi tanya jawab yang berlangsung interaktif.<br /><br />Acara tersebut dihadiri oleh Kepala Desa Sindangjaya, Sekretaris Desa Sindangjaya, serta elemen masyarakat lainnya yang berjumlah sebanyak 65 Orang.<br /><br />Hadirnya sosialisasi dari tim RSUD Cimacan diharapkan dapat meningkatkan kepercayaan masyarakat terhadap pelayanan rumah sakit yang dekat dengan masyarakat.','admin','article/20230515093034_345467844_144254371861001_3664589082701946167_n.jpg','publish','2023-05-10 09:30:34','2023-05-10 09:30:34'),(54,'Training Refresh Aplikasi SAMRS','Sosialisasi training refresh aplikasi SAMRS','0GPDCIwX3W4boSlgOEjspLfr','Adapun yang hal-hal yang disampaikan yaitu mengenai pengelolaan aset rumah sakit dalam hal:<br />1. Pemeliharaan<br />2. Perbaikan<br />3. Pinjam minjam alat antar instansi atau ruangan<br />4. Penghapusan alat yang sudah tidak layak pakai<br /><br />Dengan adanya kegiatan sosialisasi ini diharapkan adanya peningkatan dalam pengelolaan aset alat rumah sakit menggunakan aplikasi SAMRS tersebut.','admin','article/20230515093340_346371650_6006445332797239_4057942487867225641_n.jpg','publish','2023-05-11 09:33:40','2023-05-11 09:33:40'),(55,'halal bihalal keluarga besar RSUD Cimacan','Segenap keluarga besar RSUD Cimacan mengadakan halal bihalal pada hari Rabu, 10 Mei 2023 di Aula Gedung C RSUD Cimacan, yang dihadiri oleh seluruh karyawan RSUD Cimacan.','0GPDCIwX3W4boSlgOEjspLfr','Segenap keluarga besar RSUD Cimacan mengadakan halal bihalal pada hari Rabu, 10 Mei 2023 di Aula Gedung C RSUD Cimacan, yang dihadiri oleh seluruh karyawan RSUD Cimacan.<br /><br />Semoga pada momen ini, kita semua senantiasa saling memaafkan atas semua dosa dan kesalahan satu sama lain serta menjadi berkah bagi kita semua. Aamiin.<br /><br />Taqabalallahu Minna wa Minkum wa Taqabbal ya Taqabbal ya Karim.','admin','article/20230515093700_345727105_624109396279074_3951125181956032121_n.jpg','publish','2023-05-12 09:37:00','2023-05-12 09:37:00'),(56,'Kunjungan Bupati Cianjur di RSUD Cimacan','Bupati Cianjur, H.Herman Suherman menjenguk Wakil Bupati Cianjur TB Mulyana Syahrudin, hari Senin 22 Mei 2023, yang sedang melakukan perawatan di RSUD Cimacan tepatnya di ruang rawat inap VVIP.','0GPDCIwX3W4boSlgOEjspLfr','Bupati Cianjur, H.Herman Suherman menjenguk Wakil Bupati Cianjur TB Mulyana Syahrudin, hari Senin 22 Mei 2023, yang sedang melakukan perawatan di RSUD Cimacan tepatnya di ruang rawat inap VVIP.<br /><br />Seiring doa yang dipanjatkan semoga Wabup Cianjur, lekas diberikan kesehatan oleh Allah dan dapat menjalankan aktifitas kembali seperti biasanya aaamiin.','admin','article/20230524141533_348438765_274734648328386_3102192988813760366_n.jpg','publish','2023-05-24 14:15:33','2023-05-24 14:15:33'),(57,'kegiatan donor darah','Rumah Sakit Umum Daerah Cimacan telah melaksanakan kegiatan donor darah pada hari Rabu, 24 Mei 2023.','0GPDCIwX3W4boSlgOEjspLfr','Rumah Sakit Umum Daerah Cimacan telah melaksanakan kegiatan donor darah pada hari Rabu, 24 Mei 2023.<br /><br />Kegiatan ini disambut dengan antusias yang luar biasa baik dari pegawai RSUD Cimacan maupun masyarakat.<br /><br />diharapkan dengan kegiatan ini dapat membantu suplai kebutuhan darah bagi pasien yang membutuhkan serta memberikan efek kesehatan bagi pendonornya.','admin','article/20230525082746_348462465_647522327232494_3036903144172705344_n.jpg','publish','2023-05-25 08:27:46','2023-05-25 08:27:46'),(60,'Pra Evaluasi PEKPPP','Pra Evaluasi Pelaksanaan Pemantauan dan Evaluasi Kinerja Penyelenggaraan Pelayanan Publik dilaksanakan pada hari Kamis, 25 Mei 2023 oleh Tim Sekretariat Daerah bagian Organisasi Kab. Cianjur bertempat di Aula Gedung C RSUD Cimacan.','0GPDCIwX3W4boSlgOEjspLfr','Pra Evaluasi Pelaksanaan Pemantauan dan Evaluasi Kinerja Penyelenggaraan Pelayanan Publik dilaksanakan pada hari Kamis, 25 Mei 2023 oleh Tim Sekretariat Daerah bagian Organisasi Kab. Cianjur bertempat di Aula Gedung C RSUD Cimacan.<br /><br />Adanya kegiatan tersebut dalam rangka meningkatkan pelayanan publik di RSUD Cimacan.','admin','article/20231206084100_25-05-2023.jpg','publish','2023-05-25 09:19:24','2023-07-31 09:19:24'),(61,'Penerimaan Peserta PIDI','Penerimaan Peserta PIDI (Program Internship Dokter Indonesia) Kabupaten Cianjur Angkatan II Tahun 2023.','0GPDCIwX3W4boSlgOEjspLfr','Penerimaan Peserta PIDI (Program Internship Dokter Indonesia) Kabupaten Cianjur Angkatan II Tahun 2023.<br /><br />Pelaksanaan penerimaan peserta PIDI (Program Intersip Dokter Indonesia) Kabupaten Cianjur Angkatan II Tahun 2023 telah dilaksanakan pada hari, Selasa 30 Mei 2023 bertempat di Aula gedung C RSUD Cimacan.<br /><br />Acara dimulai dengan pemutaran video safety briefing dilanjutkan dengan pembukaan, do&rsquo;a, serta menyanyikan lagu indonesia raya. Turut dihadiri oleh Perwakilan Dinas Kesehatan Kabupaten Cianjur, Direktur RSUD Cimacan, Kepala Puskesmas, Pendamping PIDI, Ketua IDI Cianjur.<br /><br />Dalam kegiatan siang hari ini Perwakilan Dinas Kesehatan Kabupaten Cianjur melakukan Serah Terima Dokter Internsip ke Wahana. Dokter Internsip pada periode ini sebanyak 16 dokter yang akan ditempatkan di RSUD Cimacan, Puskesmas Karangtengah dan Puskesmas Sukaresmi selama satu tahun.<br /><br />Kegiatan ini juga berisi perkenalan, diskusi dan penandatangan kesepakatan awal oleh dokter internsip, pendamping PIDI serta kepala wahana. Acarapun ditutup dengan kegiatan foto bersama.','admin','article/20231206084202_30-05-2023.jpg','publish','2023-05-30 09:25:21','2023-07-31 09:25:21'),(62,'ORIENTASI DOKTER INTERNSIP','Rabu 31 Mei 2023 di RSUD Cimacan melakukan kegiatan orientasi dokter internsip','0GPDCIwX3W4boSlgOEjspLfr','ORIENTASI DOKTER INTERNSIP<br /><br />Rabu 31 Mei 2023 di RSUD Cimacan melakukan kegiatan orientasi dokter internsip. Kegiatan hari ini dimulai jam 07.30, kegiatan diisi dengan materi-materi sebelum 16 dokter intersip nanti akan melakukan pelayanan di Rumah Sakit dan Puskesmas.<br />Materi hari ini antara lain:<br />1. Pengenalan Rumah Sakit dan Aturan Rumah Sakit oleh Bagian Kepegawaian RSUD Cimacan<br />2. Pengenalan Aturan Pelayanan Medik oleh Bidang Medik RSUD Cimacan<br />3. Pengenalan dan Sosialisasi Komite Etik Rumah Sakit<br />4. Sosialisasi PPI oleh IPCN Komite PPI RSUD Cimacan<br />5. Sosialisasi Sasaran Keselamatan Pasien oleh POKJA SKP dan Bidang Keperawatan RSUD Cimacan<br />6. Sosialisasi Mekanisme dan SPO Rawat Inap serta Pelatihan Bantuan Hidup Dasar oleh Kepala Instalasi Rawat Inap Tim BHD dan Code Blue RSUD Cimacan<br />7. Sosialisasi Mekanisme dan SPO IGD serta Pelatihan Resusitasi Neonatus oleh Kepala Instalasi IGD dan Dokter Pelaksana.<br /><br />Kegiatan orientasi masih akan berlangsung untuk mewujudkan pelayanan kesehatan yang prima dan paripurna.','admin','article/20231206084142_31-05-2023.jpg','publish','2023-05-31 09:27:19','2023-07-31 09:27:19'),(63,'Kegiatan Orientasi Dokter Internsip Hari Ketiga','Pada Sabtu 3 Juni 2023 RSUD Cimacan mengadakan Kegiatan Orientasi Dokter Internsip Hari Ketiga.','0GPDCIwX3W4boSlgOEjspLfr','Kegiatan Orientasi Dokter Internsip Hari Ketiga<br /><br />Pada Sabtu 3 Juni 2023 RSUD Cimacan mengadakan Kegiatan Orientasi Dokter Internsip Hari Ketiga. Kegiatan ini dimulai pada pukul 07.30 dimulai dengan Absensi kehadiran dan Pembukaan dilanjutkan dengan Pembuatan Absensi dengan Sistem Finger Print oleh Tim BUANA.<br /><br />Selanjutnya dilakukan pemaparan sosialisasi dengan materi antara lain:<br />1. Sosialisasi Program Nasional oleh POKJA PROGNAS<br />2. Sosialisasi Komunikasi Efektif Rumah Sakit oleh POKJA Komunikasi Efektif dan Tim PKRS<br />3. Sosialisasi Komite Mutu Rumah Sakit oleh Komite Mutu RSUD Cimacan<br />4. Sosialisasi Kredensial Rumah Sakit oleh POKJA Kredensial<br /><br />Kegiatan diakhiri dengan pengurusan berkas &ndash; berkas dan penyusunan jadwal jaga.<br /><br />Harapannya dengan orientasi dokter internsip pelayanan semakin optimal.','admin','article/20231206084129_03-06-2023.jpg','publish','2023-06-03 09:29:18','2023-07-31 09:29:18'),(64,'Pelatihan EMR Dokter Internsip','RSUD Cimacan mengadakan Kegiatan Orientasi Dokter Internsip Hari Keempat pada, Senin 4 Juni 2023','0GPDCIwX3W4boSlgOEjspLfr','Pelatihan EMR Dokter Internsip.<br /><br />RSUD Cimacan mengadakan Kegiatan Orientasi Dokter Internsip Hari Keempat pada, Senin 4 Juni 2023. Kegiatan dimulai dengan Upacara Apel Pagi.<br /><br />Setelah seluruh dokter internsip melakukan apel pagi, mereka melaksanakan pelatihan Electronic Medical Record (EMR). Electronic Medical Record, atau sering dikenal Rekam Medis Elektronik, merupakan catatan medis pasien dalam format elektronik tentang informasi kesehatan seseorang yang dituliskan oleh satu atau lebih petugas kesehatan secara terpadu.<br /><br />RSUD Cimacan telah menerapkan sistem EMR dan dalam masa orientasi Dokter Internsip Kabupaten Cianjur, seluruh dokter internsip sebanyak 16 orang melakukan pelatihan penggunaan EMR.<br /><br />Manfaat teknologi informasi dalam rekam medis elektronik, selain untuk efisiensi pencatatan dan pengolahan data, serta menyediakan informasi yang lebih akurat dan terpercaya, yaitu memiliki tujuan untuk mengurangi medical error dan meningkatkan keamanan pasien (patient safety).','admin','article/20231206084010_05-06-2023.jpg','publish','2023-07-05 09:30:56','2023-07-31 09:30:56'),(65,'Ramah Tamah Hari Idul Adha 1444 H','RSUD Cimacan ikut merayakan Idul Adha yang diawali dengan pemotongan hewan Qurban di RSUD Cimacan.','0GPDCIwX3W4boSlgOEjspLfr','RSUD Cimacan ikut merayakan Idul Adha 1444 H yang diawali dengan pemotongan hewan Qurban di RSUD Cimacan.<br />Kegiatan dirangkai dengan Ramah Tamah Hari Raya Idul Adha RSUD Cimacan bersama Plt. Direktur (dr. Yogeswara Soeharto) dan Karyawan RSUD Cimacan yang bertempat di Aula RSUD Cimacan<br /><br />Kegiatan Ramah Tamah Hari Raya Idul Adha ikut hadiri Ibu Dr. Juliana Aritonang, MARS selaku Direktur sebelumnya dan beberapa Pensiunan RSUD Cimacan serta para Tamu Undangan berlangsung dengan hangat, Acara dilanjutkan dengan menikmati hidangan hari raya.','admin','article/20231206084114_01-07-2023.jpg','publish','2023-07-01 09:39:42','2023-07-31 09:39:42'),(66,'Kegiatan Khitanan Massal','RSUD Cimacan Gerlar Bakti Sosial Khitanan Massal gratis pada hari jum\'at 07 Juli 2023','0GPDCIwX3W4boSlgOEjspLfr','Kegiatan Khitanan Massal<br /><br />Dalam rangka memperingati Hari Jadi Kabupaten Cianjur yang ke 346<br /><br />RSUD Cimacan Gerlar Bakti Sosial Khitanan Massal gratis pada hari jum&rsquo;at 07 Juli 2023.<br /><br />kegiatan Khitanan massal di laksanakan di IGD PONEK dengan jumlah peserta 10 anak berjalan dengan lancar yang di tangani oleh dr. Feri Iskandar, Sp.B.<br /><br />Semoga dalam kegiatan Gelar Baksi Sosial Khitanan Massal ini RSUD Cimacan dapat terus memberikan manfaat sosial bagi masyarakat.','admin','article/20231206083939_07-07-2023.jpg','publish','2023-07-07 09:41:14','2023-07-31 09:41:14'),(67,'Penilaian Izin Pelayanan Dialisis','Pada tanggal 04 Juli 2023, yang bertempat di Aula RSUD Cimacan & Via Zoom Meeting , RSUD Cimacan melakukan kegiatan perihal Perizinan Berusaha Untuk Menunjang Kegiatan Usaha (PB-UMKU) Pelayanan Dialisis melalui Sistem Online Single Submission (OSS) k','0GPDCIwX3W4boSlgOEjspLfr','Penilaian Kesesuaian Izin Penyelenggaraan<br />Pelayanan Dialisis RSUD Cimacan<br /><br />Pada tanggal 04 Juli 2023, yang bertempat di Aula RSUD Cimacan &amp; Via Zoom Meeting , RSUD Cimacan melakukan kegiatan perihal Perizinan Berusaha Untuk Menunjang Kegiatan Usaha (PB-UMKU) Pelayanan Dialisis melalui Sistem Online Single Submission (OSS) kegitan ini di mulai dari pukul 09.00 s/d 12.00 WIB<br /><br />Sehubungan dengan pengajuan Rumah Sakit perihal Perizinan Berusaha Untuk Menunjang Kegiatan Usaha (PB-UMKU) Pelayanan Dialisis melalui Sistem Online Single Submission (OSS),dengan dilakukannya penilaian kesesuaian melalui kunjungan lapangan ke rumah sakit yang akan dilaksanakan melalui daring dan luring dengan tim penilaian terdiri dari :<br /><br />1. Direktorat Pelayanan Kesehatan Rujukan<br />2. Tim Kerja Hukum, Setditjen Pelayanan Kesehatan<br />3. Dinas Kesehatan Provinsi Jawa Barat<br />4. Dinas Kesehatan Kabupaten Cianjur<br />5. Koordinator PERNEFRI Wilayah Jawa Barat<br /><br />Dengan penugasan 1 (satu) orang sebagai sebagai Tim Visitasi Penetapan Penyelenggaraan Dialisis Kementerian Kesehatan.','admin','article/20231206083923_10-07-2023.jpg','publish','2023-07-10 09:43:02','2023-07-31 09:43:02'),(68,'Kegiatan apel pagi','Senin, 10 Juli 2023, Kegiatan apel pagi dilaksanakan di lingkungan RSUD Cimacan.','0GPDCIwX3W4boSlgOEjspLfr','Senin, 10 Juli 2023,<br />Kegiatan apel pagi dilaksanakan di lingkungan RSUD Cimacan.<br /><br />Kegiatan apel pagi ini dibina oleh direktur RSUD Cimacan, dr.Yogeswara Soeharto. Dalam kegiatan apel pagi yang khitmad ini beliau menyampaikan beberapa hal mengenai budaya 5 S (Senyum, Salam, Sapa , Sopan dan Santun) yang harus selalu diterapkan di lingkungan rumah sakit, terkait kedisiplinan dan sekaligus pengenalan struktur baru rumah sakit yaitu Kepala Bidang Penunjang Medik RSUD Cimacan, dr Gumilar Farto Siswoyo dan Kepala Seksi Pelayanan Keperawatan Hj. Yulia Sumiati, S.Kep.Ners.<br /><br />Semoga dengan adanya apel rutin ini, setiap langkahnya selalu kita awali dengan semangat pagi.','admin','article/20231206083903_11-07-2023.jpg','publish','2023-07-11 09:46:29','2023-07-31 09:46:29'),(69,'kunjungan kerja','Anggota DPRD Kabupaten Cianjur dari Komisi C telah melakukan kunjungan kerja (kunker) ke RSUD Cimacan Kabupaten Cianjur terkait Pengelolaan dan Pengawasan Limbah Medis.','0GPDCIwX3W4boSlgOEjspLfr','Anggota DPRD Kabupaten Cianjur dari Komisi C telah melakukan kunjungan kerja (kunker) ke RSUD Cimacan Kabupaten Cianjur terkait Pengelolaan dan Pengawasan Limbah Medis.<br /><br />Kunjungan oleh perwakilan sejumlah lima orang ini diterima langsung oleh Direktur RSUD Cimacan, dr. Yogeswara Soeharto beserta Seluruh Pejabat Administrator dan Pelaksana Fungsional Kesehatan Lingkungan.<br /><br />Kegiatan ini berlangsung dengan baik, dengan diawalinya penyajian informasi tentang mekanisme pengelolaan limbah medis baik cair maupun padat yang diakhiri dengan peninjauan langsung ke titik lokasi pengelolaan yang tersedia di RSUD Cimacan.<br /><br />Hasil dari kunjungan ini diharapkan semakin memantapkan RSUD Cimacan untuk terus menjaga komitmen terhadap kesehatan lingkungan di tengah upayanya melayani masyarakat secara paripurna.','admin','article/20231206083853_12-07-2023.jpg','publish','2023-07-12 09:49:52','2023-07-31 09:49:52'),(70,'kegiatan Desa Manjur Bungah Pisan','Direktur RSUD Cimacan , dr. Yogeswara Soeharto beserta seluruh pejabat struktural dan Tim Kesehatan RSUD Cimacan Turut hadir dalam kegiatan Desa Manjur Bungah Pisan di Desa Palasari Kecamatan Cipanas','0GPDCIwX3W4boSlgOEjspLfr','Direktur RSUD Cimacan , dr. Yogeswara Soeharto beserta seluruh pejabat struktural dan Tim Kesehatan RSUD Cimacan Turut hadir dalam kegiatan Desa Manjur Bungah Pisan di Desa Palasari Kecamatan Cipanas<br /><br />Dengan berbagai kegiatan yang di awali dengan jalan santai, senam sehat, pembagian dorprize ,khitanan massal dan berbagai kegitan lainnya.<br /><br />Dalam kegiatan Desa Manjur Bungah Pisan , Pemkab memberikan berbagai bantuan kepada Desa palasari dan juga masyarakat yang turut hadir.<br /><br />Bantuan yang di berikan oleh pemkab diantaranya dimulai dari jalan, internet gratis, bibit tanaman dan pupuk, legalitas pesantren dan bantuan kobong , bantuan UMKM, PJU, dll.<br /><br />Dalam Kegiatan Desa Manjur Bungah Pisan , RSUD Cimacan ikut serta dalam memeriahkan acara tersebut dan berkontribusi dalam khitanan massal.','admin','article/20231206083832_13-07-2023.jpg','publish','2023-07-13 09:51:43','2023-07-31 09:51:43'),(71,'Kegiatan apel pagi','Senin, 17 Juli 2023,\r\nKegiatan apel pagi dilaksanakan di lingkungan RSUD Cimacan.','0GPDCIwX3W4boSlgOEjspLfr','Senin, 17 Juli 2023,<br />Kegiatan apel pagi dilaksanakan di lingkungan RSUD Cimacan.<br /><br />Kegiatan apel pagi ini dipimpin oleh direktur RSUD Cimacan, dr.Yogeswara Soeharto. Dalam kegiatan apel pagi yang khitmad ini beliau menyampaikan beberapa hal mengenai :<br />1. Pelayanan dimaksimalkan, tumbuhkan empati untuk pasien dan keluarga pasien.<br />2. Bagaimana cara berkomunikasi dengan pasien dan keluarga pasien dengan baik dan benar.<br />3. Menyamaratakan pasien BPJS maupun umum.<br />4. Memberikan pemahaman yang jelas kepada pasien dengan edukasi yang kita sampaikan agar tidak ada misspersepsi.<br /><br />Semoga dengan adanya apel rutin pagi ini, setiap langkahnya selalu kita awali dengan semangat pagi.','admin','article/20231206083820_17-07-2023.jpg','publish','2023-07-17 09:53:10','2023-07-31 09:53:10'),(72,' Penyuluhan Kesehatan','Pada kegiatan Penyuluhan Kesehatan kali ini yang dilakukan oleh tim PKRS RSUD Cimacan bekerjasama dengan BPJS Kesehatan RSUD Cimacan.','0GPDCIwX3W4boSlgOEjspLfr','Hallo Sobat Cimacan !!!<br /><br />Pada kegiatan Penyuluhan Kesehatan kali ini yang dilakukan oleh tim PKRS RSUD Cimacan bekerjasama dengan BPJS Kesehatan RSUD Cimacan.<br /><br />Nah.. Untuk kesempatan Sosialisasi pada hari Selasa, 18 Juli 2023 yang bertempat di Kantor Desa Cipendawa, dihadiri oleh Kepala Desa Cipendawa , H. Acep Ganda Permana, S.IP serta jajaran kader Desa Cipendawa.<br /><br />Dalam kegiatan tersebut , Tim PKRS RSUD Cimacan bersama BPJS Kesehatan RSUD Cimacan menyampaikan terkait layanan dan fasilitas kesehatan yang dapat dinikmati oleh masyarakat, serta berbagai pengalaman terkait permasalahan layanan pendaftaran yang langsung ditanggapi oleh tim penyuluhan.<br /><br />Jika Sobat Cimacan memiliki kritik dan saran untuk RSUD Cimacan jangan sungkan untuk mengubungi WA Pengaduan dan Operator Telpon , yang nomornya tertera di Bio Instagram kami ya Sobat.','admin','article/20231206083808_18-07-2023.jpg','publish','2023-07-18 09:54:42','2023-07-31 09:54:42'),(73,'5 Momen Saat Akan Melakukan Kebersihan Tangan','Ingat!!! 2 Sebelum 3 Setelah\r\n5 Momen Saat Akan Melakukan Kebersihan Tangan','EWc4aGs2mJrjY5LKOoT0gMXV','Ingat!!! 2 Sebelum 3 Setelah<br />5 Momen Saat Akan Melakukan Kebersihan Tangan','admin','article/20231206105808_26-06-2019.jpg','publish','2019-06-26 11:05:29','2023-07-31 11:05:29'),(74,'Tata cara HANDRUB dengan alkohol','Ingat ingat ingat !!! Tata cara HANDRUB juga harus tau y guys,','EWc4aGs2mJrjY5LKOoT0gMXV','Ingat ingat ingat !!! Tata cara HANDRUB juga harus tau y guys,','admin','article/20231206105822_27-06-2019.jpg','publish','2019-06-27 11:08:47','2023-07-31 11:08:47'),(75,'Info Sekitar HIV AIDS','Selalu Utamakan Perlindungan Keluarga\r\nLindungi Orang Tersayang Dari HIV \"Jauhi Penyakitnya Bukan Orangnya\"','AEx5ug1DFMJjsyX8YIGRTnm7','Selalu Utamakan Perlindungan Keluarga<br />Lindungi Orang Tersayang Dari HIV \"Jauhi Penyakitnya Bukan Orangnya\"','admin','article/20231206105835_27-08-2019.jpg','publish','2019-08-27 11:14:57','2023-07-31 11:14:57'),(76,'Aktivitas fisik 30 menit setiap hari','Aktivitas fisik 30 menit setiap hari y gaissss,, manfaatnya :','EWc4aGs2mJrjY5LKOoT0gMXV','Aktivitas fisik 30 menit setiap hari y gaissss,, manfaatnya :<br />1. Menjaga kesehatan agar terhindar dari penyakit<br />2. Meningkatkan kepercayaan diri<br />3. Meningkatkan otot dan daya tahan tubuh<br />4. Mengurangi stres dan emosional<br />5. Membuat tidur lebih nyenyak<br />6. Membakar kalori, mencegah kelebihan berat badan<br />7. Membuat wajah &amp; tubuh lebih segar.','admin','article/20231206105857_20-01-2020.jpg','publish','2020-01-20 11:16:55','2023-07-31 11:16:55'),(77,'NOVEL CORONA Virus','Waspada PNEUMONIA CORONA Virus wuhan.. Apa itu NOVEL CORONA Virus..? Sobat Sehat harus tau y gejala klinis dan pencegahan ya.','EWc4aGs2mJrjY5LKOoT0gMXV','Waspada PNEUMONIA CORONA Virus wuhan.. Apa itu NOVEL CORONA Virus..? Sobat Sehat harus tau y gejala klinis dan pencegahan ya.','admin','article/20231206110021_29-01-2020.jpg','publish','2020-01-29 11:18:28','2023-07-31 11:18:28'),(78,'Kenali Tanda Bahaya Pada Kehamilan','Sobat Sehat,, Kenali Tanda Bahaya Pada Kehamilan..?','AEx5ug1DFMJjsyX8YIGRTnm7','Sobat Sehat,, Kenali Tanda Bahaya Pada Kehamilan..? <br />1. Muntah terus dan tidak mau makan.<br />2. Air Ketuban Keluar Sebelum Waktunya.<br />3. Demam Tinggi<br />4. Janin Dirasakan Kurang Bergerak Dibandingkan Sebelumnya.<br />5. Bengkak Kaki Tangan Dan Wajah atau Sakit Kepala Yang Berlebihan Disertai Kejang.<br />6. Pendarahan Pada Hamil Muda Dan Tua.','admin','article/20231206110033_05-02-2020.jpg','publish','2020-02-05 11:20:59','2023-07-31 11:20:59'),(79,'Anosmia','Halo Sahabat Cimacan!\r\nAkhir-akhir ini pasti sering mendengar istilah ‘Anosmia’.\r\nJadi sebenarnya apa sih anosmia itu?\r\nYuk kita bahas..','EWc4aGs2mJrjY5LKOoT0gMXV','Halo Sahabat Cimacan!<br />Akhir-akhir ini pasti sering mendengar istilah &lsquo;Anosmia&rsquo;.<br />Jadi sebenarnya apa sih anosmia itu?<br />Yuk kita bahas..<br /><br />Anosmia adalah hilangnya kemampuan seseorang untuk mencium bau. Orang yang mengalami anosmia tidak dapat mencium aroma apapun, sebagai contoh, anosmia dapat membuat penderitanya tidak dapat mencium wangi bunga, aroma masakan, bau tubuh sendiri, bahkan bau busuk. Anosmia dapat menjadi salah satu gejala infeksi COVID-19.<br /><br />Anosmia umumnya disebabkan oleh radang, pembengkakan atau penyumbatan di rongga hidung yang membuat bau atau aroma tidak dapat terdeteksi oleh saraf di hidung. Selain itu, anosmia juga dapat terkadi karena adanya masalah pada sistem saraf yang berfungsi untuk mendeteksi aroma atau bau.<br /><br />Tapi kenapa infeksi COVID-19 bisa menimbulkan gejala anosmia dok?<br />Diduga akibat adanya peradangan di rongga hidung ketika virus Corona terhirup masuk ke dalam tubuh melalui hidung dan menyerang system saraf yang berfungsi sebagai indra penciuman. Gejala cenderung muncul pada awal masa infeksi dan umumnya pulih dalam waktu 28 hari, namun bisa lebih.<br /><br />Bagaimana pengobatannya dok?<br />Dari penelitian didapatkan cuci hidung dengan Nacl 0,9% 2x30ml setiap hari dan Latihan penghidu dengan 4 aroma berbeda (mawar, lemon, cengkeh, dan eucalyptus) setiap hari dalam jangka waktu 3 hingga 6 bulan dapat membantu pemulihan gejala anosmia.<br /><br />Apabila Sahabat Cimacan merasakan ada gejala atau ingin mengetahui lebih lanjut dapat memeriksakan diri ke Klinik THT yang buka setiap Senin-Jumat mulai pk 08.30-selesai.','admin','article/20231206110047_23-08-2021.jpg','publish','2021-08-23 11:27:05','2023-07-31 11:27:05'),(80,'DAGUSIBU','Halooo Sahabat Cimacan..\r\nAda yang pernah bingung bagaimana cara mendapatkan, menggunakan, menyimpan, dan membuang obat dengan benar?','EWc4aGs2mJrjY5LKOoT0gMXV','Halooo Sahabat Cimacan..<br />Ada yang pernah bingung bagaimana cara mendapatkan, menggunakan, menyimpan, dan membuang obat dengan benar?<br /><br />Tenang! Kali ini kita akan membahas mengenai DAGUSIBU.<br /><br />Apa itu DAGUSIBU?<br />DAGUSIBU merupakan singkatan dari Dapatkan, Gunakan, Simpan, dan Buang yang bertujuan untuk memberikan informasi mengenai cara mendapatkan, menggunakan, menyimpan, dan membuang obat dengan benar.<br /><br />1. DAPATKAN<br />Dapatkan obat di tempat yang paling terjamin yaitu pada fasilitas kesehatan seperti apotek, instalasi farmasi rumah sakit, puskesmas, klinik, toko obat dan klinik bersama. Pada saat menerima obat pastikan memeriksa informasi label kemasan meliputi: Nama obat, Logo obat, Nomor izin edar, Batas kadaluarsa obat, tampilan fisik kemasan.<br /><br />2. GUNAKAN<br />Gunakan obat sesuai dengan aturan minum obat yang tertera pada wadah atau etiket, menggunakan sesuai indikasi, waspada efek samping dan kontraindikasi. Pastikan apoteker memberitahukan cara pemakaian obat yang diberikandengan jelas. Khususnya untuk obat dengan sediaan yang tidak terlalu diketahui oleh masyarakat umum.<br /><br />3. SIMPAN<br />Simpan obat supaya obat yang kita pakai tidak rusak maka kita perlu menyimpan obat dengan benar, sesuai petunjukpemakaian yang ada di dalam kemasan Kebanyakan obat tidak boleh terpapar oleh sinar matahari secara langsung, untuk itu obat perlu disimpan di tempat yang tertutup dan kering.<br /><br />4. BUANG<br />Buang obat bila telah kadaluarsa atau rusak dan tidak boleh diminum kembali. Obat jangan dibuang secara sembarangan, agar tidak disalahgunakan. Obat dapat dibuang dengan terlebih dahulu dibuka kemasannya, direndam dalam air, laludipendam didalam tanah.<br /><br />Bagaimana sahabat Cimacan? Sekarang sudah tidak bingung lagi bukan?<br />Untuk informasi lebih lanjut, dapat berkonsultasi dengan apoteker kami','admin','article/20231206110100_02-10-2021.jpg','publish','2021-10-02 11:29:30','2023-07-31 11:29:30'),(81,'Omicron','Halooo Sahabat Cimacan..\r\nMincan mau berbagi info nih mengenai mitos dan fakta mengenai Omicron!','EWc4aGs2mJrjY5LKOoT0gMXV','Halooo Sahabat Cimacan..<br />Mincan mau berbagi info nih mengenai mitos dan fakta mengenai Omicron!<br /><br />Sejak teridentifikasi oleh WHO sebagai mutasi terbaru virus corona yang dinamai Omicron, banyak sekali mitos-mitos yang beredar di kalangan masyarakat dan memberikan berita yang kurang tepat serta menyebabkan kekhawatiran di kalangan masyarakat. Untuk itu, yuk kita simak beberapa mitos dan fakta seputar Covid-19 varian Omicron!<br /><br />Tetap jaga kesehatan dan patuhi protokol kesehatan yang ada yaa Sahabat Cimacan!<br />Bersama, kita bisa melawan pandemi ini.','admin','article/20231206110113_10-02-2022.jpg','publish','2022-02-10 11:33:04','2023-07-31 11:33:04'),(82,'Informasi Umum Hipertensi','Halo Sahabat Cimacan.. Dalam rangka World Hypertension Day yang jatuh pada hari ini, Selasa, 17 Mei 2022. Mincan mau berbagi info mengenati Hipertensi nih!','EWc4aGs2mJrjY5LKOoT0gMXV','Halo Sahabat Cimacan..<br />Dalam rangka World Hypertension Day yang jatuh pada hari ini, Selasa, 17 Mei 2022. Mincan mau berbagi info mengenati Hipertensi nih!<br /><br />Hipertensi atau tekanan darah tinggi adalah keadaan dimana tekanan darah (TD) sistolik &gt;140 mmHg dan/atau tekanan darah diastolik &gt;90 mmHg pada dua kali pengukuran dengan selang waktu satu menit dalam keadaan cukup istirahat atau tenang.<br /><br />Hipertensi sendiri terbagi menjadi beberapa tingkat atau grade.<br />Yuk kita simak sama-sama klasifikasi hipertensi..<br /><br />Tekanan darah normal apabila TD sistolik &lt;120 DAN TD diastolik &lt;80<br /><br />Pre hipertensi apabila TD sistolik 120 -129 ATAU TD diastolik 80-89<br /><br />Hipertensi Grade I apabila TD sistolik 140-159 ATAU TD diastolik 90-99<br /><br />Hipertensi Grade II apabila TD sistolik &gt;160 ATAU TD diastolik &gt;100<br /><br />Krisis Hipertensi apabila TD sistolik &gt;180 ATAU TD diastolik &gt;120<br /><br />Sumber:<br />World Health Organization<br />American Heart Association<br />Kementerian Kesehatan RI','admin','article/20231206110158_17-05-2022.jpg','publish','2022-05-17 11:39:20','2023-07-31 11:39:20'),(83,'pencegahan hipertensi','Hipertensi dapat dicegah dan dikendalikan dengan bersama-sama kita melakukan PATUH:','EWc4aGs2mJrjY5LKOoT0gMXV','Hipertensi dapat dicegah dan dikendalikan dengan bersama-sama kita melakukan PATUH:<br /><br />- Periksa kesehatan secara rutin dan ikuti anjuran dokter<br />- Atasi penyakit dengan pengobatan yang tepat dan teratur<br />- Tetap diet dengan gizi seimbang<br />- Upayakan aktivitas fisik dengan aman<br />- Hindari asap rokok, alkohol dan zat karsinogenik lainnya<br /><br />Yuk bersama kita kenali, cegah, dan kendalikan Hipertensi dengan berperilaku CERDIK!<br />- Cek kesehatan secara rutin<br />- Enyahkan asap rokok<br />- Rajin aktivitas fisik<br />- Diet seimbang<br />- Istirahat cukuo<br />- Kelola stress<br /><br />Sumber:<br />World Health Organization<br />American Heart Association<br />Kementerian Kesehatan RI','admin','article/20231206110230_17-05-2022(2).jpg','publish','2022-05-17 11:41:10','2023-07-31 11:41:10'),(84,'cara mengukur tekanan darah di rumah','Hipertensi sering disebut dengan The Silent Killer karena tidak memiliki gejala khusus dan hanya diketahui dengan mengukur tekanan darah.','EWc4aGs2mJrjY5LKOoT0gMXV','Hipertensi sering disebut dengan The Silent Killer karena tidak memiliki gejala khusus dan hanya diketahui dengan mengukur tekanan darah.<br /><br />Apakah Sahabat Cimacan sudah mengetahui cara mengukur tekanan darah yang tepat? Yuk Mincan kasih info mengenai cara yang benar dan tepat..<br /><br />1. Pasien dalam keadaan tenang<br />2. Duduk dan istirahat selamat 3-5 menit sebelum dilakukan pengukuran tekanan darah<br />3. Kandung kemih kosong (tidak sedang menahan buang air kecil)<br />4. Hindari konsumsi kopi, alkohol, dan rokok minimal 30 menit sebelum pengukuran<br />5. Posisi duduk bersandar dan rileks<br />6. Posisi kaki tidak menyilang dan telapak kaki rata menyentuh lantai<br />7. Lengan diposisikan di atas meja dengan ketinggian setara dengan posisi jantung<br />8. Apabila menggunakan baju lengan panjang, usahakan lipatan baju tidak menghambat aliran darah<br />9. Selama pengukuran dilangan berbicara dan bergerak<br />10. Gunakan alat tensimeter yang tervalidasi<br />11. Gunakan manset dengan ukuran sesuai dan posisi batas bawah manset sekitar 2,5cm di atas siku (2 jari di atas siku)<br />12. Melakukan pengukuran tekanan darah sebanyak 2 kali dengan jeda 1-2 menit, serta pengukuran ke-3 (tambahan) apabila didapatkan perbedaan &gt;5 mmHg pada kedua pengukuran<br />13. Hitung rerata tekanan darah<br /><br />Sumber:<br />World Health Organization<br />American Heart Association<br />Kementerian Kesehatan RI','admin','article/20231206110248_17-05-2022(3).jpg','publish','2022-05-17 12:54:35','2023-07-31 12:54:35'),(85,'Stunting','Halooo Sahabat Cimacan\r\nMincan ingin berbagi informasi kesehatan niihh..','AEx5ug1DFMJjsyX8YIGRTnm7','Halooo Sahabat Cimacan<br />Mincan ingin berbagi informasi kesehatan niihh..<br /><br />Remaja putri yang menderita anemia ketika menjadi ibu hamil memiliki resiko melahirkan anak dengan berat bayi lahir rendah (BBLR) &amp; Stunting<br /><br />Stunting adalah kondisi gagal tumbuh pada anak balita akibat kekurangan gizi kronik sehingga cenderung lebih pendek dari anak seusianya. Berdasarkan data WHO terdapat 154 juta lebih di dunia menderita stunting dan 87 juya berada di Asia. Prevalensi balita stunting di Indonesia sendiri pada tahun 2021 berkisar 24.4%<br /><br />Apa yang bisa dilakukan??<br />1. Minum Tablet Tambah Darah teratur! 1 tablet setiap minggu<br />2. Makan makanan yang bergizi seimbang, tinggi protein dan kaya akan zat besi<br />3. Perbanyak buah dan sayur yang kaya akan vitamin C, E dan A<br />4. Melakukan aktivitas fisik dan minum air putih minimal 8 gelas/hari<br /><br />Mari kita bersama cegah stunting agar masa depan menjadi lebih sehat','admin','article/20231206110302_26-05-2022.jpg','publish','2022-05-26 12:56:59','2023-07-31 12:56:59'),(87,'World No Tobacco Day','Hari Tanpa Tembakau Sedunia (HTTS) atau dikenal dengan World No Tobacco Day diperingati setiap tanggal 31 Mei setiap tahunnya.','EWc4aGs2mJrjY5LKOoT0gMXV','Hari Tanpa Tembakau Sedunia (HTTS) atau dikenal dengan World No Tobacco Day diperingati setiap tanggal 31 Mei setiap tahunnya.<br /><br />Tujuan dari hari peringatan tersebut adalah untuk meningkatkan kesadaran masyarakat tentang efek bahaya dari konsumsi rokok atau tembakau.<br /><br />Tema HTTS tahun ini adalah \"Tobacco: Threat to Our Environment\" yang menyoroti bahaya merokok terhadap lingkungan.<br /><br />Rokok terdiri dari &gt;4000 macam zat berbahaya dan dapat menyebabkan penyakit kanker. Berbagai efek buruk yang dapat ditimbulkan dari kebiasaan merokok adalah:<br />- Kanker paru<br />- Kanker laring<br />- Meningkatkan risiko penyakit jantung<br />- Meningkatkan risiko stroke<br />- Penyakit paru kronik<br />- Osteoporosis<br />- Merusak gigi dan bau mulut tidak sedap<br />- Kemandulan dan impotensi<br />- Dan masih banyak lagi<br /><br />Tembakau dan segala jenis rokok termasuk rokok konvensional maupun elektrok sangat berbahaya bagi tubuh. Selain itu, rokok tidak hanya mengancam kesehatan diri sendiri, namun juga kesehatan keluarga, teman, dan orang sekitar.<br /><br />Diketahui berdasarkan data dari WHO, lebih dari 7 juta orang meninggal akibat kebiasaan merokok setiap tahunnya.<br /><br />Melalui peringatan Hari Tanpa Tembakau Sedunia ini, kami mengajak kita semua bersama-sama untuk meningkatkan kesadaran kita bersama untuk katakan TIDAK pada rokok!<br /><br />Sumber:<br />WHO<br />Kemenkes RI','admin','article/20231206110315_31-05-2022.jpg','publish','2022-05-31 12:58:48','2023-07-31 12:58:48'),(88,'hari Demam Berdarah Dengue','Hari DBD Se-Asean: Tingkatkan Pencegahan Melalui 3M Plus','EWc4aGs2mJrjY5LKOoT0gMXV','Hari DBD Se-Asean: Tingkatkan Pencegahan Melalui 3M Plus<br /><br />Sejak tahun 2010, Negara yang tergabung dalam anggota ASEAN termasuk Indonesia, sepakat untuk memperingati hari Demam Berdarah Dengue (DBD) se- Asean pada tanggal 15 Juni.<br /><br />DBD merupakan penyakit berbahaya yang menyebabkan kematian, penyakit ini berasal dari Virus Dengue kemudian dihantarkan oleh gigitan nyamuk Aedes Sp.<br /><br />Berdasarkan laporan Menteri Kesehatan (Kemenkes) jumlah kasus DBD per Februari di tahun 2022, menyentuh angka 13.776 orang yang dinyatakan terkena kasus DBD.<br /><br />Kasus DBD akan mengalami peningkatan saat menghadapi musim pancaroba, Sementara Itu Indonesia sedang mengalami perubahan musim dari musim dingin ke musim kemarau.<br /><br />Oleh karena itu, untuk menghindari terjangkitnya virus dengue tersebut, kita bisa menerapkan 3M Plus yaitu:<br /><br />- Menguras dan menyikat<br />- Menutup penampungan air<br />- Memanfaatkan/mendaur ulang barang bekas<br />- Plus : pencegah gigitan dan perkembang biakan nyamuk<br /><br />Mari wujudkan masyarakat yang cerdas untuk memilih mencegah dari pada mengobati.','admin','article/20231206110332_15-06-2022.jpg','publish','2022-06-15 13:00:49','2023-07-31 13:00:49'),(89,'Penularan Penyakit kuku dan mulut pada hewan','APAKAH PENYAKIT KUKU DAN MULUT PADA HEWAN DAPAT MENULAR KEPADA MANUSIA?','EWc4aGs2mJrjY5LKOoT0gMXV','APAKAH PMK MENULAR KEPADA MANUSIA?<br /><br />Berdasarkan data Kementerian Pertanian menunjukan, di Indonesia jumlah sapi potong sekira 16 juta ekor, sapi perah hampir 600 ribu, dan kerbau hampir 900 ribu. Jadi total, ada sekitar 18 juta ekor hewan ternak. Hewan-hewan ini diternakkan dalam skala kecil perorangan dan skala besar yang dikelola sebagai industri peternakan.<br /><br />Otomatis lalu lintas perdagangan hewan ternak tersebut bersinggungan dengan manusia baik lokal maupun domestik. Hal tersebut diduga berkontribusi pada menyebarnya wabah PMK. Apalagi menghadapi Hari Raya Idul Adha 1443 H yang sarat akan ibadah qurban.<br /><br />Kemudian apakah PMK ini menular pada manusia?<br /><br />Organisasi Kesehatan Hewan Dunia, menyatakan bahwa PMK bukan masalah kesehatan masyarakat. Penyebab PMK adalah FMD virus (FMDV). Virus ini masuk dalam genus Aphthovirus dari famili Picornaviridae, yang memiliki tujuh tipe (A, O, C, SAT1, SAT2, SAT3, dan Asia1) yang endemik di berbagai negara. penyakit infeksi virus ini bersifat akut, sangat menular pada hewan berkuku genap/belah (cloven-hoofed dan hewan pemamah biak atau tidak bersifat zoonosis.<br /><br />Media penularan virus ini melalui lendir dan urine hewas, selain itu juga dari aerosol yang mengandung virus. Masyarakat diharapkan tidak khawatir berlebihan terhadap penyakit ini, kemungkinan besar akan bersinggungan dengan permasalahan bisnis dan produk yang berasal dari hewan ternak tersebut.<br /><br />Sahabat Cimacan, tetap terapkan hidup sehat dan selalu memilah dan memilih makanan yang akan kita santap ya!','admin','article/20231206110343_23-06-2022.jpg','publish','2022-06-23 13:04:50','2023-07-31 13:04:50'),(90,'Hari Bidan Nasional','Hallo sahabat cimacan.... Dalam rangka memperingati hari bidan nasional yang jatuh pada tanggal 24 juni 2022,','EWc4aGs2mJrjY5LKOoT0gMXV','Hallo sahabat cimacan<br /><br />Dalam rangka memperingati hari bidan nasional yang jatuh pada tanggal 24 juni 2022,<br />Mincan ingin berterimakasih kepada para bidan yang telah senan tiasa menjalankan tugas mulia sebagai bidan. Sebab bidan melindungi kesehatan reproduksi melalui pemberdayaan perempuan dan optimalisasi pelayanan kebidanan, Terimakasih telah melayani dengan sepenuh hati.<br /><br />Mari bersama-sama mewujudkan derajat kesehatan indonesia yang lebih optimal untuk indonesia yang lebih baik dengan menciptakan pelayanan prima terutama oleh bidan-bidan yang ada di Indonesia khususnya di wilayah Kabupaten Cianjur.','admin','article/20231206110355_24-06-2022.jpg','publish','2022-06-24 13:08:26','2023-07-31 13:08:26'),(91,'Hari Anti Narkoba Internasiona','Hari Anti Narkoba Internasional jatuh pada tanggal 26 juni 2022.','EWc4aGs2mJrjY5LKOoT0gMXV','Hari Anti Narkoba Internasional jatuh pada tanggal 26 juni 2022.<br /><br />Hari Anti Narkotika Internasional adalah sebuah hari internasional Perserikatan Bangsa-Bangsa menentang penyalahgunaan obat-obatan dan perdagangan obat-obatan ilegal. Peringatan dan penetapan tanggal 26 juni sebagai Hari Anti Narkoba sedunia disepakati oleh United Nation Office on Drugs and Crime (UNODC) pada tanggal 26 Juni 1988. Perayaan hari HANI dilaksankan setiap tahun guna memperkuat aksi secara universal dan untuk menumbuhkan kesadaran masyarakat tentang bahaya penyalahgunaan narkoba.<br /><br />Mari bersama-sama mewujudkan indonesia menjadi generasi cerdas bebas narkoba!','admin','article/20231206110516_26-06-2022.jpg','publish','2022-07-06 13:09:41','2023-07-31 13:09:41'),(92,'Hari Keluarga Nasional','Selamat Hari Keluarga Nasional ke -29,','EWc4aGs2mJrjY5LKOoT0gMXV','Selamat Hari Keluarga Nasional ke -29,<br /><br />optimalisasi delapan fungsi keluarga yakni : agama, sosial budaya, cinta kasih, melindungi, reproduksi, pendidikan, ekonomi dan fungsi pembinaan lingkungan untuk mewujudkan keluarga berketahanan yang menjadikan keluarga berkualitas.<br /><br />Terapkan 8 fungsi keluarga ini sebagai pilar mengentaskan stunting.<br /><br />Ayo, cegah stunting agar anak bangsa terbebas dari stunting!','admin','article/20231206110705_29-06-2022.jpg','publish','2022-07-29 13:11:33','2023-07-31 13:11:33'),(93,'penyakit jantung koroner','Apakah Benar serangan jantung merupakan asal usul dari penyakit jantung koroner?','EWc4aGs2mJrjY5LKOoT0gMXV','Apakah Benar serangan jantung merupakan asal usul dari penyakit jantung koroner?<br /><br />Perlu Sahabat Cimacan ketahui, serangan jantung merupakan gangguan jantung serius ketika otot jantung tidak mendapat aliran darah.<br /><br />Artinya, gangguan jantung ini akan mengganggu fungsi jantung sendiri yang memiliki peranan mengalirkan darah ke seluruh tubuh.<br /><br />Risiko berbahaya dari serangan jantung yakni dapat menyebabkan kematian.<br /><br />Terhambatnya aliran darah ke otot atau dalam istilah medis disebut Infark Miokard penyebab utamanya adalah penyakit jantung koroner.<br /><br />Waduh bahaya sekali kalau tidak segera tertangani ya!<br /><br />yuk sahabat cimacan kita mulai hidup sehat dan menerapkan pola hidup yang baik.','admin','article/20231206110410_05-07-2022.jpg','publish','2022-07-05 13:13:38','2023-07-31 13:13:38'),(94,'periksa kesehatan secara rutin','Hallo Sahabat Cimacan... Cek kesehatan merupakan bentuk upaya menyayangi diri sendiri maupun keluarga terdekat anda.','EWc4aGs2mJrjY5LKOoT0gMXV','Hallo Sahabat Cimacan<br /><br />Cek kesehatan merupakan bentuk upaya menyayangi diri sendiri maupun keluarga terdekat anda.<br /><br />Pemeriksaan secara rutin setiap 6 bulan sekali atau 1 tahun sekali sangat dianjurkan, untuk mendapatkan pencegahan dan pengobatan se dini mungkin.<br /><br />Yuk, periksakan kesehatan diri se segera mungkin. Lebih baik mencegah dari pada mengobati.','admin','article/20231206110536_13-07-2022.jpg','publish','2022-07-13 13:15:23','2023-07-31 13:15:23'),(95,'Hari Anak Nasional','Selamat Hari Anak Nasional','8achmr6KSCqQVAiIefxJOLl3','Selamat Hari Anak Nasional<br /><br />peringatan Hari Anak Nasional dimaknai sebagai kepedulian seluruh bangsa terhadap perlindungan anak Indonesia agar tumbuh dan berkembang secara optimal.<br /><br />Kementerian Pemberdayaan Perempuan dan Perlindungan Anak mengangkat tema HAN 2022 dengan \"Anak Terlindungi, Indonesia Maju\".<br /><br />Dalam hal ini Pemerintah berupaya untuk menyoroti momentum Hari Anak Nasional 2022 untuk menggugah kepedulian dan partisipasi seluruh komponen bangsa Indonesia dalam menjamin pemenuhan hak anak, yakni atas hak hidup, tumbuh, berkembang, dan berpartisipasi secara wajar sesuai harkat dan martabat kemanusiaan, serta mendapat perlindungan dari kekerasan dan diskriminasi.','admin','article/20231206110552_23-07-2022.jpg','publish','2022-07-23 13:16:56','2023-07-31 13:16:56'),(96,'pedoman gizi seimbang','Hallo Sahabat Cimacan!... Sudah tahukah kamu tentang pedoman gizi seimbang?\r\nKali ini mincan akan berbagi pengetahuan terkait pedoman gizi seimbang yang bisa kita lakukan.','EWc4aGs2mJrjY5LKOoT0gMXV','Hallo Sahabat Cimacan!<br /><br />Sudah tahukah kamu tentang pedoman gizi seimbang?<br />Kali ini mincan akan berbagi pengetahuan terkait pedoman gizi seimbang yang bisa kita lakukan.<br /><br />10 pedoman Gizi Seimbang ini sangat lah penting untuk menentukan pola hidup sehat kita, guna menghindari resiko tinggi dari berbagai macam penyakit di tubuh kita.<br /><br />Yuk, mulai terapkan pola hidup sehat dari hal terkecil yaitu asupan pangan ditubuh kita.','admin','article/20231206110605_26-07-2022.jpg','publish','2022-07-26 13:23:27','2023-07-31 13:23:27'),(97,'manfaat istirahat cukup','Hallo Sahabat Cimacan!... Jam tidur yang tepat sangatlah penting, banyak hal yang akan berpengaruh jika kita tidak mengatur jam tidur dengan baik.\r\nKonsentrasi merupakan faktor terpenting dari pengaruh pola tidur kita.','EWc4aGs2mJrjY5LKOoT0gMXV','Hallo Sahabat Cimacan!<br /><br />Jam tidur yang tepat sangatlah penting, banyak hal yang akan berpengaruh jika kita tidak mengatur jam tidur dengan baik.<br />Konsentrasi merupakan faktor terpenting dari pengaruh pola tidur kita.<br /><br />Yuk jaga pola istirahat kita dengan baik, agar lebih berkonsentrasi dalam beraktifitas.','admin','article/20231206110621_27-07-2022.jpg','publish','2022-07-27 13:24:43','2023-07-31 13:24:43'),(98,'Penyakit Tidak Menular','Hallo Sahabat Cimacan!... Apakah kalian tahu? Saat ini Penyakit Tidak Menular (PTM) seperti kanker, diabetes, jantung, hipertensi, dll berada pada lonjakan lebih tinggi dari penyakit menular?','EWc4aGs2mJrjY5LKOoT0gMXV','Hallo Sahabat Cimacan!<br /><br />Apakah kalian tahu? Saat ini Penyakit Tidak Menular (PTM) seperti kanker, diabetes, jantung, hipertensi, dll berada pada lonjakan lebih tinggi dari penyakit menular?<br /><br />Pola hidup masyarakat saat ini telah berubah, yang mana cenderung mengkonsumsi makanan berkalori tinggi namun sangat jarang melakukan aktivitas fisik, maka akan memicu penyebab PTM yang timbul karena gaya hidup yang kurang sehat.<br /><br />Selain menerapkan pola hidup yang sehat, kita juga bisa melakukan cek sedari dini tekanan darah, gula darah sewaktu, dan indeks masa tubuh atau lingkar perut.<br /><br />Yuk, sayangi diri mu sendiri. Peduli dan konsultasikan dirimu di pelayanan kesehatan terdekat!','admin','article/20231206110743_03-08-2022.jpg','publish','2022-08-03 13:27:13','2023-07-31 13:27:13'),(99,'Pekan ASI Sedunia','Selamat Hari ASI Sedunia atau Pekan ASI Sedunia 2022','AEx5ug1DFMJjsyX8YIGRTnm7','Selamat Hari ASI Sedunia atau Pekan ASI Sedunia 2022<br /><br />&rsquo;Step Up For Breastfeeding: Educate and Support&rsquo; atau &rsquo;Langkah Untuk Menyusui: Edukasi dan Dukungan&rsquo;.<br /><br />Setiap tahunnya pada tanggal 1-7 Agustus diperingati sebagai World Breastfeeding Week&nbsp;atau Pekan ASI Sedunia.<br /><br />Hari ASI Sedunia atau Pekan ASI Sedunia 2022 fokus pada penguatan kapasitas peran yang harus melindungi, mempromosikan, dan mendukung pemberian ASI di berbagai lapisan masyarakat.<br /><br />Yuk, berikan yang terbaik dari ASI untuk tumbuh kembang si buah hati.','admin','article/20231206110724_01-08-2022.jpg','publish','2022-08-01 13:28:41','2023-07-31 13:28:41'),(100,'bulan imunisasi anak nasional','Halo Sahabat Cimacan.. Selama masa pandemi COVID-19 kemarin, cakupan imunisasi dasar lengkap pada bayi turun drastis','8achmr6KSCqQVAiIefxJOLl3','Halo Sahabat Cimacan..<br />Selama masa pandemi COVID-19 kemarin, cakupan imunisasi dasar lengkap pada bayi turun drastis. Hal ini terjadi karena beberapa hal seperti:<br />- Gangguan rantai pasokan<br />- Aturan pembatasan kegiatan<br />- Jumlah tenaga kesehatan yang terbatas<br />- Orang tua/wali asuh enggan ke fasilitas layanan kesehatan karena takut tertular covid<br /><br />Sehingga menyebabkan sekitar &gt;1,7 juta bayi belum mendapatkan imunisasi dasar selama periode tahun 2019-2021.<br /><br />Untuk itu pemerintah menggiatkan kembali imunisasi untuk mengejar cakupan imuniasi yang rendah dengan menggelar Bulan Imunisasi Anak Nasional (BIAN)!<br /><br />BIAN dilakukan dalam dua tahap, yaitu:<br />Tahap 1: Mei 2022<br />Mencakup daerah Sumatera, Kalimantan, Sulawesi, Nusa Tenggara, Maluku, dan Papua<br />Imunisasi campak dan rubella untuk usia 9-15 tahun<br />Imunisasi OPV, IPV, dan DPT-HB-Hib untuk usia 12-59 bulan<br /><br />Tahap 2: Agustus 2022<br />Mencakup daerah Jawa dan Bali<br />Imunisasi campak dan rubella untuk usia 9-59 bulan<br />Imunisasi OPV, IPV, dan DPT-HB-Hib untuk usia 12-59 bulan<br /><br />Yuk segera periksa buku KIA (kesehatan Ibu Anak) dan pastikan jadwal imunisasi anak tepat waktu!','admin','article/20231206110755_16-08-2022.jpg','publish','2022-08-16 13:30:50','2023-07-31 13:30:50'),(101,'vitamin a untuk anak kita','Halo Sahabat Cimacan..\r\nTahukan Sahabat bahwa vitamin A memiliki banyak sekali manfaat, terutama untuk anak-anak?','8achmr6KSCqQVAiIefxJOLl3','Halo Sahabat Cimacan..<br />Tahukan Sahabat bahwa vitamin A memiliki banyak sekali manfaat, terutama untuk anak-anak?<br /><br />Vitamin A merupakan salah satu vitamin penting yang wajib diberikan kepada anak. Beberapa manfaatnya yaitu:<br />1. Baik untuk kesehatan mata serta dapat mengurangi risiko kelainan atau penyakit pada mata.<br />2. Meningkatkan daya tahan tubuh terhadap penyakit dan infeksi<br />3. Penting dalam membantu proses pertumbuhan<br /><br />Terdapat 2 dosis berbeda nih Sahabat:<br />- Kapsul vitamin A berwarna biru dengan dosis 100.000 IU untuk bayi usia 6-11 bulan<br />- Kapsul vitmain A berwarna merah dengan dosis 200.000 IU untuk balita berusia 12-59 bulan<br /><br />Bulan Agustus merupakan Bulan Vitamin A<br />Yuk Sahabat Cimacan, jangan lupa membawa anak-anak Sahabat ke fasilitas layanan kesehatan terdekat untuk mendapatkan vitamin A','admin','article/20231206110807_20-08-2022.jpg','publish','2022-08-20 13:32:15','2023-07-31 13:32:15'),(102,'Hari Palang Merah Indonesia','Tanggal 17 September 2022 diperingati sebagai Hari Palang Merah Indonesia (PMI).','EWc4aGs2mJrjY5LKOoT0gMXV','Tanggal 17 September 2022 diperingati sebagai Hari Palang Mera